video_id,publishedAt,channelId,title,description,thumbnails.default.url,thumbnails.default.width,thumbnails.default.height,thumbnails.medium.url,thumbnails.medium.width,thumbnails.medium.height,thumbnails.high.url,thumbnails.high.width,thumbnails.high.height,channelTitle,liveBroadcastContent
I_-UTiocbb8,2017-05-31T16:53:29.000Z,UC8Ij9GZARIb6zXdKJLYXlpw,"Lalibela, cerca del cielo. Cristina García Rodero","El Fernán Gómez. Centro Cultural de la Villa (Madrid) reúne el trabajo realizado por Cristina García Rodero (Puertollano, Ciudad Real, 1949) entre 2000 y 2009 ...",https://i.ytimg.com/vi/I_-UTiocbb8/default.jpg,120,90,https://i.ytimg.com/vi/I_-UTiocbb8/mqdefault.jpg,320,180,https://i.ytimg.com/vi/I_-UTiocbb8/hqdefault.jpg,480,360,hoyesarte,none
SeMXsYgr5wU,2016-07-05T10:07:25.000Z,UCKBLe5cZl38w8nK4Vl2jHyA,Ethiopie : Lalibela,"Ville sainte des chrétiens orthodoxes d'Éthiopie, Lalibella est connue pour ses onze églises monolithes médiévales taillées et creusées à même le roc, dont la ...",https://i.ytimg.com/vi/SeMXsYgr5wU/default.jpg,120,90,https://i.ytimg.com/vi/SeMXsYgr5wU/mqdefault.jpg,320,180,https://i.ytimg.com/vi/SeMXsYgr5wU/hqdefault.jpg,480,360,videocyrot,none
_v4QqJEKES0,2013-09-28T20:20:44.000Z,UCV9xPeWfu3BxDKZdtb6R3Tg,Ethiopian Orthodox Church lalibela,,https://i.ytimg.com/vi/_v4QqJEKES0/default.jpg,120,90,https://i.ytimg.com/vi/_v4QqJEKES0/mqdefault.jpg,320,180,https://i.ytimg.com/vi/_v4QqJEKES0/hqdefault.jpg,480,360,Roha Lasta,none
0k90BCUML98,2017-08-23T12:22:12.000Z,UCkqKu5W1eGxn7Wm-6tlGGrg,Lalibela Express live @ Folkwelt Festival - lale lale,,https://i.ytimg.com/vi/0k90BCUML98/default.jpg,120,90,https://i.ytimg.com/vi/0k90BCUML98/mqdefault.jpg,320,180,https://i.ytimg.com/vi/0k90BCUML98/hqdefault.jpg,480,360,imperialtiger1,none
bwWVBYLTqm4,2017-07-17T20:48:03.000Z,UCwes_SbZuxuXMeYdnZcvAFQ,Yehunie Belay | My Trip to Lalibela Ethiopia 2014  | Part 1,"Yehunie Belay | My Trip to Lalibela Ethiopia 2014 | Part 1 Any unauthorized use, copying or distribution is strictly prohibited. Copyright ©2018: Google+ ...",https://i.ytimg.com/vi/bwWVBYLTqm4/default.jpg,120,90,https://i.ytimg.com/vi/bwWVBYLTqm4/mqdefault.jpg,320,180,https://i.ytimg.com/vi/bwWVBYLTqm4/hqdefault.jpg,480,360,Yehunie Belay,none
7k90A9HnLn4,2013-05-13T10:29:54.000Z,UCW6_2hUFm-jh3aToPvMZfJQ,"Lalibela, Ethiopia: Part I","We discuss the rock hewn churches at Lalibela, Ethiopia. Subscribe for more art history videos. Part II will be up as soon as possible ...",https://i.ytimg.com/vi/7k90A9HnLn4/default.jpg,120,90,https://i.ytimg.com/vi/7k90A9HnLn4/mqdefault.jpg,320,180,https://i.ytimg.com/vi/7k90A9HnLn4/hqdefault.jpg,480,360,Amor Sciendi,none
oyQHz7BuUgw,2017-07-30T13:00:06.000Z,UCxEFRGuZHF4Jg715sWefz7A,Wollo Lalibela Kinet  - ከመ ከም (Keme Kem) - Traditional Ethiopian Music (1975 E.C),"Classic song by Maritu Legesse and Mohammed Yimer - ""Keme Kem"" Subscribe to my channel for more videos. _ Facebook: ...",https://i.ytimg.com/vi/oyQHz7BuUgw/default.jpg,120,90,https://i.ytimg.com/vi/oyQHz7BuUgw/mqdefault.jpg,320,180,https://i.ytimg.com/vi/oyQHz7BuUgw/hqdefault.jpg,480,360,EthioNigist Ethiopian Music,none
tmqopNsHFko,2015-09-14T20:40:36.000Z,UCVcc_sbg3AcXLV9vVufJrGg,"Discover Ethiopia,  Lalibela city",,https://i.ytimg.com/vi/tmqopNsHFko/default.jpg,120,90,https://i.ytimg.com/vi/tmqopNsHFko/mqdefault.jpg,320,180,https://i.ytimg.com/vi/tmqopNsHFko/hqdefault.jpg,480,360,ebstv worldwide,none
cA7F80KCago,2017-06-02T22:39:31.000Z,UC8i4H9S837-RVkDnoO0TE5Q,African Dreamtravel | Äthiopien Reisen | Felsenkirchen von Lalibela,"African Dreamtravel Äthiopien Reisen . Die Felsenkirchen von Lalibela sind weltweit bekannt für die elf monolithischen Kirchen, die in die rote Basaltlava ...",https://i.ytimg.com/vi/cA7F80KCago/default.jpg,120,90,https://i.ytimg.com/vi/cA7F80KCago/mqdefault.jpg,320,180,https://i.ytimg.com/vi/cA7F80KCago/hqdefault.jpg,480,360,African Dreamtravel,none
KGhS47gSNPE,2016-09-13T14:06:41.000Z,UCedys6pdphxA02suFOQQ4vA,"3D Model of Beta Giorgis in lalibela, Ethiopia",Animation based on 3D Laserscans of Beta Giorgis (Church of Saint George). This famous church stands alone in the southwest. Dating to the early 13th century ...,https://i.ytimg.com/vi/KGhS47gSNPE/default.jpg,120,90,https://i.ytimg.com/vi/KGhS47gSNPE/mqdefault.jpg,320,180,https://i.ytimg.com/vi/KGhS47gSNPE/hqdefault.jpg,480,360,zamaniproject,none
yIwB_bnVDNo,2016-12-05T21:49:15.000Z,UCa_ObI9ag4TJDNOVSLOfflg,Hot Steppa · Joseph Lalibela Original Dubplate + Yahel Version,"Give thanks for this Original Dubplate from Joseph Lalibela · Hot Steppa · 2 Cuts + Yahel & DubDillah ""DubMeditation"" version . Mastering at Lemurecords ...",https://i.ytimg.com/vi/yIwB_bnVDNo/default.jpg,120,90,https://i.ytimg.com/vi/yIwB_bnVDNo/mqdefault.jpg,320,180,https://i.ytimg.com/vi/yIwB_bnVDNo/hqdefault.jpg,480,360,Benjamin Carranza,none
2sMYvnP-QEY,2016-01-25T17:38:27.000Z,UCaZFzZN7UCm_IbfsRy1TndA,DUBQUAKE 23-01-2016 // CHANNEL ONE with JOSEPH LALIBELA,ZOO : ◊ Channel One (UK) https://soundcloud.com/channel-one-so... ◊ O.B.F Sound System (Dubquake Records / FR) https://soundcloud.com/obfsoundsystem ...,https://i.ytimg.com/vi/2sMYvnP-QEY/default.jpg,120,90,https://i.ytimg.com/vi/2sMYvnP-QEY/mqdefault.jpg,320,180,https://i.ytimg.com/vi/2sMYvnP-QEY/hqdefault.jpg,480,360,Alexandrine Burgaud,none
7xvLMgpNl9E,2016-11-29T14:43:19.000Z,UCZAN-iCJ0t57vCutpwLdhuA,"Maribela Hotel, Lalibela","Our lovely room at the Maribela Hotel, Lalibela, Ethiopia.",https://i.ytimg.com/vi/7xvLMgpNl9E/default.jpg,120,90,https://i.ytimg.com/vi/7xvLMgpNl9E/mqdefault.jpg,320,180,https://i.ytimg.com/vi/7xvLMgpNl9E/hqdefault.jpg,480,360,Roddy MacLeod,none
9dQxWs4vlBw,2017-06-06T13:59:31.000Z,UChvPDboaAtwYS-tH29FqvVQ,Underground Tunnels of Rock Hewn Churches in Lalibela - Ethiopia May 2017,"Bomani in Ethiopia on an incredible 7 city tour May 7-14, 2017. This journey includes Addis Ababa, Bahir Dar, Gondar, Axum, Lalibela, Shashamene and ...",https://i.ytimg.com/vi/9dQxWs4vlBw/default.jpg,120,90,https://i.ytimg.com/vi/9dQxWs4vlBw/mqdefault.jpg,320,180,https://i.ytimg.com/vi/9dQxWs4vlBw/hqdefault.jpg,480,360,Bomani Tyehimba,none
ZMd2qMFpSvM,2007-04-23T08:06:24.000Z,UChG4sW_EK0ZHR063SotSsjw,An Ethiopian Orthodox Easter in Lalibela,Better quality clip at: http://www.youtube.com/watch?v=vlhYBL1d97M In the rock hewn Churches of Lalibela people praying on Good Friday. My blog on this: ...,https://i.ytimg.com/vi/ZMd2qMFpSvM/default.jpg,120,90,https://i.ytimg.com/vi/ZMd2qMFpSvM/mqdefault.jpg,320,180,https://i.ytimg.com/vi/ZMd2qMFpSvM/hqdefault.jpg,480,360,wokling,none
8VhPQRnrpyM,2016-09-20T12:40:08.000Z,UCKOzVzkcGLbBvuCwOjXepmg,Lalibela and Aksum Ethiopia,"The Impossible temple in Lalibela and Aksum obelisk in Ethiopia. I reupload this video with new music, in old video was blocked sound. Невозможный храм ...",https://i.ytimg.com/vi/8VhPQRnrpyM/default.jpg,120,90,https://i.ytimg.com/vi/8VhPQRnrpyM/mqdefault.jpg,320,180,https://i.ytimg.com/vi/8VhPQRnrpyM/hqdefault.jpg,480,360,vlad9vt,none
-QyONlBCKRA,2018-03-31T15:12:15.000Z,UCNEl_F33EANGa7ey-lFCZjw,Joseph Lalibela - Trodding (Young Warrior Presents/312) - 2017,Album: VA - Young Warrior Presents/312 (Jah Shaka Music) - 2017 - Itunes: https://itunes.apple.com/nl/album/young-warrior-presents-312/1256979425 ...,https://i.ytimg.com/vi/-QyONlBCKRA/default.jpg,120,90,https://i.ytimg.com/vi/-QyONlBCKRA/mqdefault.jpg,320,180,https://i.ytimg.com/vi/-QyONlBCKRA/hqdefault.jpg,480,360,SALAMI SOUND SELEKTA,none
U8piPk7y1Gk,2013-09-13T03:32:43.000Z,UCN4OgC7oEVEMsYz4ivCnvHg,"ETHIOPIA, the spectacular Saturday market of LALIBELA","SUBSCRIBE: http://www.youtube.com/c/VicStefanu - ETHIOPIA, the Saturday market of LALIBELA: This is one of the most incredible experiences in my life, ...",https://i.ytimg.com/vi/U8piPk7y1Gk/default.jpg,120,90,https://i.ytimg.com/vi/U8piPk7y1Gk/mqdefault.jpg,320,180,https://i.ytimg.com/vi/U8piPk7y1Gk/hqdefault.jpg,480,360,Vic Stefanu - World Travels and Adventures,none
NhmMHlFRnHk,2017-06-05T11:20:40.000Z,UCQa4rGDNZ7ABmTR6YF015Ug,lalibela,elegance \\ lalibelas literature. attention earned. Singer: Unknown child from a village Title: The Literature of the Ethiopian Poor Youtube account: Abebe Kebede ...,https://i.ytimg.com/vi/NhmMHlFRnHk/default.jpg,120,90,https://i.ytimg.com/vi/NhmMHlFRnHk/mqdefault.jpg,320,180,https://i.ytimg.com/vi/NhmMHlFRnHk/hqdefault.jpg,480,360,Adhanet K,none
g8bD77sOMv4,2016-02-05T11:33:18.000Z,UCx8pCDzeiIQaKuVsj46G3Dg,ልደት በደብረ ሮሃ(ላሊበላ) በአማራ ቴሌቪዠዥን/x-mass in DEBERE ROHA/Lalibela/ ON AMHARA TV,ልደት በደብረ ሮሃ(ላሊበላ) በአማራ ቴሌቪዠዥን/x-mass in DEBERE ROHA/Lalibela/ ON AMHARA TV.,https://i.ytimg.com/vi/g8bD77sOMv4/default.jpg,120,90,https://i.ytimg.com/vi/g8bD77sOMv4/mqdefault.jpg,320,180,https://i.ytimg.com/vi/g8bD77sOMv4/hqdefault.jpg,480,360,Amhara Mass Media Agency Ethiopia,none
1WmtoTKCnKo,2017-08-11T04:00:00.000Z,UCaOt0Q9-7YvUr8IhymLBuYg,"Lalibela and its suburban Church, Ethiopia Part 5 (Travel documentary in Urdu Hindi)","Lalibela (Amharic: ላሊበላ?) is a town in Amhara Region, northern Ethiopia famous for monolithic rock-cut churches. The whole of Lalibela offers an exceptional ...",https://i.ytimg.com/vi/1WmtoTKCnKo/default.jpg,120,90,https://i.ytimg.com/vi/1WmtoTKCnKo/mqdefault.jpg,320,180,https://i.ytimg.com/vi/1WmtoTKCnKo/hqdefault.jpg,480,360,Travel with Syed Mehdi,none
E7Of1uBmbn0,2016-05-26T07:54:47.000Z,UCEIN_jNuUX1YYsIurAAMSSg,Cafe Lalibela Ethiopian Restaurant in Footscray VIC serving Good Food and Drinks,"Cafe Lalibela Ethiopian Restaurant has introduced many a newcomer to an authentic, aromatic and artful Ethiopian dining experience. Cafe Lalibela 91 Irving ...",https://i.ytimg.com/vi/E7Of1uBmbn0/default.jpg,120,90,https://i.ytimg.com/vi/E7Of1uBmbn0/mqdefault.jpg,320,180,https://i.ytimg.com/vi/E7Of1uBmbn0/hqdefault.jpg,480,360,Big Review TV,none
lhTPhBcqONA,2017-03-09T18:44:56.000Z,UCGycbaqHw9hnCD9h5gB7oiQ,"Lalibela & Gheralta Mountains Adventure, Ethiopia",www.yellowwoodadventures.com.,https://i.ytimg.com/vi/lhTPhBcqONA/default.jpg,120,90,https://i.ytimg.com/vi/lhTPhBcqONA/mqdefault.jpg,320,180,https://i.ytimg.com/vi/lhTPhBcqONA/hqdefault.jpg,480,360,YellowWood Adventures,none
dzYlSXbhJ2c,2013-10-09T03:33:13.000Z,UC5BQfoTI-D5nAUZLw2j8kvQ,ROOTS INJECTION RI10028 JOSEPH LALIBELA RAS MUFFET,ROOTS INJECTION 10'' RI10028 ** JOSEPH LALIBELA ...,https://i.ytimg.com/vi/dzYlSXbhJ2c/default.jpg,120,90,https://i.ytimg.com/vi/dzYlSXbhJ2c/mqdefault.jpg,320,180,https://i.ytimg.com/vi/dzYlSXbhJ2c/hqdefault.jpg,480,360,RootsAmbassada Ambassada,none
92JLTK0aXyc,2013-01-06T10:14:02.000Z,UCN4OgC7oEVEMsYz4ivCnvHg,"ETHIOPIA, inside LALIBELA'S magnificent and historic CHURCHES","SUBSCRIBE: http://www.youtube.com/c/VicStefanu - Let's go inside Lalibela's churches and let's view these historic and fascinating buildings - Lalibela, Ethiopia ...",https://i.ytimg.com/vi/92JLTK0aXyc/default.jpg,120,90,https://i.ytimg.com/vi/92JLTK0aXyc/mqdefault.jpg,320,180,https://i.ytimg.com/vi/92JLTK0aXyc/hqdefault.jpg,480,360,Vic Stefanu - World Travels and Adventures,none
4zj2EI_Pa74,2017-05-21T16:05:17.000Z,UCDlRAOaPytEfCrCi6VkYEAg,"Joseph Lalibela - Mark Of The Beast / Come As You Are - 10"" - Roots Injection",This vinyl record is available on reggae dub vinyl shop : https://www.reggaedub.org/en/10/1589-Joseph-Lalibela-Mark-Of-The-Beast_Come-As-You-Are.html ...,https://i.ytimg.com/vi/4zj2EI_Pa74/default.jpg,120,90,https://i.ytimg.com/vi/4zj2EI_Pa74/mqdefault.jpg,320,180,https://i.ytimg.com/vi/4zj2EI_Pa74/hqdefault.jpg,480,360,ReggaeDub Shop,none
i7jTlZEULME,2009-02-11T14:31:16.000Z,UCAAHxHIMPT4rTkQawPeDVvg,Ethiopia Lalibela Churches Jim Rogers,Leading economic expert Jim Rogers traveled to 150 countries over 150000 miles in three years - follow his adventures here on FentonReport. In this video Jim ...,https://i.ytimg.com/vi/i7jTlZEULME/default.jpg,120,90,https://i.ytimg.com/vi/i7jTlZEULME/mqdefault.jpg,320,180,https://i.ytimg.com/vi/i7jTlZEULME/hqdefault.jpg,480,360,Bruce Fenton,none
dHeVP0QVVbQ,2017-11-28T03:52:36.000Z,UCUfPjdiEOuxMD5f8r3WagBw,Ben Abeba Restaurant - Lalibela Ethiopia,,https://i.ytimg.com/vi/dHeVP0QVVbQ/default.jpg,120,90,https://i.ytimg.com/vi/dHeVP0QVVbQ/mqdefault.jpg,320,180,https://i.ytimg.com/vi/dHeVP0QVVbQ/hqdefault.jpg,480,360,panther4x4,none
cEqI2xiOiC4,2012-05-02T06:19:22.000Z,UC46KzL7lchkMpeD37ZAw4Ig,Tuff Lion - Lalibela,Disc: Ten Strings * Reggae Fari Selekta * Find us on FACEBOOK.,https://i.ytimg.com/vi/cEqI2xiOiC4/default.jpg,120,90,https://i.ytimg.com/vi/cEqI2xiOiC4/mqdefault.jpg,320,180,https://i.ytimg.com/vi/cEqI2xiOiC4/hqdefault.jpg,480,360,Renato Salazar,none
_9kzZ14W7fQ,2013-06-03T13:09:56.000Z,UCedys6pdphxA02suFOQQ4vA,"Animation of the 3D Laser-Scan Model ""Biet Emanuel"" Church in Lalibela, Ethiopia",The animation is based on Laserscans of Biet Emmanuel (Church of Saint Emmanuel) This church is in the eastern part of the lalibela church complex.,https://i.ytimg.com/vi/_9kzZ14W7fQ/default.jpg,120,90,https://i.ytimg.com/vi/_9kzZ14W7fQ/mqdefault.jpg,320,180,https://i.ytimg.com/vi/_9kzZ14W7fQ/hqdefault.jpg,480,360,zamaniproject,none
yVPWNy_dVQ0,2017-06-06T13:19:22.000Z,UChvPDboaAtwYS-tH29FqvVQ,Interview with Tour Guide in the Holly City of Lalibela - Ethiopia May 2017,"Bomani in Ethiopia on an incredible 7 city tour May 7-14, 2017. This journey includes Addis Ababa, Bahir Dar, Gondar, Axum, Lalibela, Shashamene and ...",https://i.ytimg.com/vi/yVPWNy_dVQ0/default.jpg,120,90,https://i.ytimg.com/vi/yVPWNy_dVQ0/mqdefault.jpg,320,180,https://i.ytimg.com/vi/yVPWNy_dVQ0/hqdefault.jpg,480,360,Bomani Tyehimba,none
jZE57QfxIU8,2015-05-03T16:18:17.000Z,UCGqrwdJrtXH8hrJHmOHPGeA,"JAHSOULJAH RECORDS feat. JOSEPH LALIBELA, FITTA WARRI, FAR EAST, SISTA HABESHA & RAS MOA - OUT NOW!!",JSJ-12002 SIDE A A1 JOSEPH LALIBELA - IAM AN ETHIOPIAN A2 FAR EAST meets SISTA HABESHA & RAS MOA - FOR H.I.M. GLORY JSJ-12002 SIDE B B1 ...,https://i.ytimg.com/vi/jZE57QfxIU8/default.jpg,120,90,https://i.ytimg.com/vi/jZE57QfxIU8/mqdefault.jpg,320,180,https://i.ytimg.com/vi/jZE57QfxIU8/hqdefault.jpg,480,360,rasforareason,none
BLPl8iwdZZg,2013-06-01T19:16:32.000Z,UCt5ttXmc0dgctKegt9Rv2Rg,Lalibela Meditation Chant,Christian Monks in Ethiopia's Lalibela. Filmed this while I visited the holy churches of Lalibella.,https://i.ytimg.com/vi/BLPl8iwdZZg/default.jpg,120,90,https://i.ytimg.com/vi/BLPl8iwdZZg/mqdefault.jpg,320,180,https://i.ytimg.com/vi/BLPl8iwdZZg/hqdefault.jpg,480,360,MalcolmXtra,none
CZJ9fUH1UVs,2011-01-26T23:03:16.000Z,UCyAwvSDM3BlY9vUwFSS0eCA,"Timkat 2011 Lalibela, Ethiopia, part 2","Timkat, the Ethiopian Orthodox celebration of Epiphany, in Lalibela, with its rock-hewn monolithic, free-standing churches, is one of the most exciting and ...",https://i.ytimg.com/vi/CZJ9fUH1UVs/default.jpg,120,90,https://i.ytimg.com/vi/CZJ9fUH1UVs/mqdefault.jpg,320,180,https://i.ytimg.com/vi/CZJ9fUH1UVs/hqdefault.jpg,480,360,Nikos Mangafas,none
YSnrNOPRvhg,2007-06-08T04:42:52.000Z,UCc7n5Td8WVEtVdui-yb6I9w,LALIBELA Ethiopia,"A Trailer of an upcoming Documentary Film about the wonders and mystery of Lalibela Ethiopia. By Addis Art & Culture, L.L.C.in collaboration with Addis Film ...",https://i.ytimg.com/vi/YSnrNOPRvhg/default.jpg,120,90,https://i.ytimg.com/vi/YSnrNOPRvhg/mqdefault.jpg,320,180,https://i.ytimg.com/vi/YSnrNOPRvhg/hqdefault.jpg,480,360,addisculture,none
sSLI3exLoiA,2015-11-05T10:56:50.000Z,UCnyk1GKTBXwZXvKRE4NlO7g,"Church carved from the living rock | Bet Giyorgis, Lalibela, Ethiopia",Lalibela — A small town on the slopes of Moun Prytula Abuna Yosef that is famous for its monolithic rock-cut churches. It was the political and cultural capital of ...,https://i.ytimg.com/vi/sSLI3exLoiA/default.jpg,120,90,https://i.ytimg.com/vi/sSLI3exLoiA/mqdefault.jpg,320,180,https://i.ytimg.com/vi/sSLI3exLoiA/hqdefault.jpg,480,360,World Punjabi News,none
geKfZR_rRog,2011-06-12T12:17:53.000Z,UC8OeaNBRgWIRHMT88D2dDpA,gossaye tesfaye lalibela ;dawit tilahun 1st arrangement,ethiopian music about lalibela`s song ( girl ),https://i.ytimg.com/vi/geKfZR_rRog/default.jpg,120,90,https://i.ytimg.com/vi/geKfZR_rRog/mqdefault.jpg,320,180,https://i.ytimg.com/vi/geKfZR_rRog/hqdefault.jpg,480,360,Dawit Tilahun,none
Bo6K-d9kzIY,2017-11-09T11:47:03.000Z,UCHO6SLKdPdJqyvXCa9rAGOg,Dub Dynasty play Joseph Lalibela - Babylon ls falling,,https://i.ytimg.com/vi/Bo6K-d9kzIY/default.jpg,120,90,https://i.ytimg.com/vi/Bo6K-d9kzIY/mqdefault.jpg,320,180,https://i.ytimg.com/vi/Bo6K-d9kzIY/hqdefault.jpg,480,360,Earth Kingdom,none
e_OyF91j6uY,2016-02-11T02:40:11.000Z,UCsQk4LE7QldUd6XFThKZCqg,TV Olodum - Etiopia A Cruz de Lalibela - 2016 Canta Mateus Vidal Musica do Femadum 2015.,,https://i.ytimg.com/vi/e_OyF91j6uY/default.jpg,120,90,https://i.ytimg.com/vi/e_OyF91j6uY/mqdefault.jpg,320,180,https://i.ytimg.com/vi/e_OyF91j6uY/hqdefault.jpg,480,360,Tv Olodum,none
H8iFUzarpCA,2010-01-27T23:11:29.000Z,UCJ2rFauTKraN2vAS0tdBafw,Lalibela Song,A song about what the Explorers got up to in 2008 when rennouveting a school in Lalibela-ela-ela.,https://i.ytimg.com/vi/H8iFUzarpCA/default.jpg,120,90,https://i.ytimg.com/vi/H8iFUzarpCA/mqdefault.jpg,320,180,https://i.ytimg.com/vi/H8iFUzarpCA/hqdefault.jpg,480,360,WEESUvideos,none
X-LSTKy3pPc,2015-12-15T17:27:17.000Z,UC1dkDvk6PbogiO_YWzdKUwA,Dexter Story - Lalibela (Official Video 8mm version),Lalibela features on the Dexter Story album 'Wondem' released on Soundway Records. Available to buy here http://smarturl.it/DexterDirect Click here to ...,https://i.ytimg.com/vi/X-LSTKy3pPc/default.jpg,120,90,https://i.ytimg.com/vi/X-LSTKy3pPc/mqdefault.jpg,320,180,https://i.ytimg.com/vi/X-LSTKy3pPc/hqdefault.jpg,480,360,SoundwayRecords,none
GNgCyHFvCzI,2012-06-22T16:08:07.000Z,UCDzLPcNr-rCXvD19Wy_mD3g,Lalibela Le Chiese forgiate dagli Angeli,,https://i.ytimg.com/vi/GNgCyHFvCzI/default.jpg,120,90,https://i.ytimg.com/vi/GNgCyHFvCzI/mqdefault.jpg,320,180,https://i.ytimg.com/vi/GNgCyHFvCzI/hqdefault.jpg,480,360,Giacomo Catania,none
Od9Vj5ErL2I,2014-08-12T20:00:09.000Z,UCW6Gj3FjkvD5WMLvuLg6jOA,Lalibela Restaurant in Greece,"Ethiopian cultural clothes & dancing show in Athens, Greece.... June7/ 2014.",https://i.ytimg.com/vi/Od9Vj5ErL2I/default.jpg,120,90,https://i.ytimg.com/vi/Od9Vj5ErL2I/mqdefault.jpg,320,180,https://i.ytimg.com/vi/Od9Vj5ErL2I/hqdefault.jpg,480,360,mamush hussein,none
sByyZ3Usaqk,2017-08-04T04:00:30.000Z,UCaOt0Q9-7YvUr8IhymLBuYg,"Lalibela's World Famous Churches, Ethiopia Part 4 (Travel documentary in Urdu Hindi)","Lalibela (Amharic: ላሊበላ?) is a town in Amhara Region, northern Ethiopia famous for monolithic rock-cut churches. The whole of Lalibela offers an exceptional ...",https://i.ytimg.com/vi/sByyZ3Usaqk/default.jpg,120,90,https://i.ytimg.com/vi/sByyZ3Usaqk/mqdefault.jpg,320,180,https://i.ytimg.com/vi/sByyZ3Usaqk/hqdefault.jpg,480,360,Travel with Syed Mehdi,none
_ElfExwlyd8,2008-08-31T08:59:35.000Z,UCsoZ8Y_ZcAiBBTdeR7KmL5Q,Lalibela BBC arround the world. The true Cross Celebration Part 2,Lalibela the eight wonder of the world.,https://i.ytimg.com/vi/_ElfExwlyd8/default.jpg,120,90,https://i.ytimg.com/vi/_ElfExwlyd8/mqdefault.jpg,320,180,https://i.ytimg.com/vi/_ElfExwlyd8/hqdefault.jpg,480,360,Lalibelatown,none
3Oq_TUewnfE,2013-02-07T23:18:59.000Z,UC_-_Se07oFnI_uwOq6JHrlg,Caribou - Lalibela (Thology Remix),Taken from the Wizard Sleeve Beat Emporium Vol.1 FREE DOWNLOAD: http://bit.ly/Yy2AyR www.soundcloud.com/thology.,https://i.ytimg.com/vi/3Oq_TUewnfE/default.jpg,120,90,https://i.ytimg.com/vi/3Oq_TUewnfE/mqdefault.jpg,320,180,https://i.ytimg.com/vi/3Oq_TUewnfE/hqdefault.jpg,480,360,Wizard Sleeve,none
VpT8qAtQY3o,2016-03-08T16:16:02.000Z,UC0W_Yekej1YoYk801Lt0Img,Timkat in Lalibela,"Ethiopian Orthodox Christian celebration of Timkat (Epiphany) in Lalibela, with procession, dancing priests, holy water distribution.",https://i.ytimg.com/vi/VpT8qAtQY3o/default.jpg,120,90,https://i.ytimg.com/vi/VpT8qAtQY3o/mqdefault.jpg,320,180,https://i.ytimg.com/vi/VpT8qAtQY3o/hqdefault.jpg,480,360,Spencer Weart,none
aVvIMFd65HQ,2014-08-01T00:18:25.000Z,UCuE34ZZRU4y8wf0JVco9XqQ,MEGALITHIC CHURCHES IN AFRICA  Lalibela Aksum,vlad9vt https://www.youtube.com/watch?v=WtESQDAqFW4&list=UUKOzVzkcGLbBvuCwOjXepmg.,https://i.ytimg.com/vi/aVvIMFd65HQ/default.jpg,120,90,https://i.ytimg.com/vi/aVvIMFd65HQ/mqdefault.jpg,320,180,https://i.ytimg.com/vi/aVvIMFd65HQ/hqdefault.jpg,480,360,eyeopen,none
sYTF8UVJiPM,2015-05-14T10:46:48.000Z,UCeSjGDDlBovJjo654WYu6hA,Ethiopia/ Lalibela (Leddet Festival) 4 Part 26,Welcome to my travelchannel.On my channel you can find almost 1000 films of more than 70 countries. See the playlist on my youtube channel.,https://i.ytimg.com/vi/sYTF8UVJiPM/default.jpg,120,90,https://i.ytimg.com/vi/sYTF8UVJiPM/mqdefault.jpg,320,180,https://i.ytimg.com/vi/sYTF8UVJiPM/hqdefault.jpg,480,360,Nurettin Yilmaz,none
10bzNJVSaHA,2018-03-08T11:02:10.000Z,UCYRF7dbMB_3N4vg1punGl1Q,Maribela Hotel - Lalibela,Hotel Maribela is located in the heart of Lalibela mountains. spacious and modern rooms all with breath taking views of the Ethiopian Highlands. Maribela Hotel ...,https://i.ytimg.com/vi/10bzNJVSaHA/default.jpg,120,90,https://i.ytimg.com/vi/10bzNJVSaHA/mqdefault.jpg,320,180,https://i.ytimg.com/vi/10bzNJVSaHA/hqdefault.jpg,480,360,Maribela Hotel - Lalibela,none
Nb5hMWdxGuU,2017-11-24T17:10:20.000Z,UCeffaUOrqVZuGyIik6Z3UPQ,"ETHIOPIA Timkat Lalibela (2017) Documentary, Travel, Road Trip, ጥምቀት, Timqet","ETHIOPIA Timkat festival LALIBELA January 2017, travel, report, documentary (English Version by Cristal Sénès) Vidéo : Jacques TREVISAN record with Sony ...",https://i.ytimg.com/vi/Nb5hMWdxGuU/default.jpg,120,90,https://i.ytimg.com/vi/Nb5hMWdxGuU/mqdefault.jpg,320,180,https://i.ytimg.com/vi/Nb5hMWdxGuU/hqdefault.jpg,480,360,jacques TREVISAN,none
85-ef3pe0iE,2012-11-16T19:41:00.000Z,UCOFIWpNeov-fwCJQDKheEbQ,Lalibela Ethiopie,"Ville sainte des chrétiens orthodoxes d'Éthiopie, Lalibela est célèbre pour ses onze églises monolithes médiévales taillées et creusées à même le roc, dont la ...",https://i.ytimg.com/vi/85-ef3pe0iE/default.jpg,120,90,https://i.ytimg.com/vi/85-ef3pe0iE/mqdefault.jpg,320,180,https://i.ytimg.com/vi/85-ef3pe0iE/hqdefault.jpg,480,360,christophe vaillant,none
ODgAtdzBDdA,2015-03-12T12:48:31.000Z,UCRjfGrf9PP-J6TTyuaUg_4A,"Lalibela, iglesias talladas en roca",,https://i.ytimg.com/vi/ODgAtdzBDdA/default.jpg,120,90,https://i.ytimg.com/vi/ODgAtdzBDdA/mqdefault.jpg,320,180,https://i.ytimg.com/vi/ODgAtdzBDdA/hqdefault.jpg,480,360,La Odisea Del Misterio,none
Elr5Dx3Zj-Y,2017-10-22T23:00:01.000Z,UC8SPhPoZ1FZs2fu-o1Gb_NA,Geoffs Highway View :  Ethiopia   Lalibela to Woldiya,,https://i.ytimg.com/vi/Elr5Dx3Zj-Y/default.jpg,120,90,https://i.ytimg.com/vi/Elr5Dx3Zj-Y/mqdefault.jpg,320,180,https://i.ytimg.com/vi/Elr5Dx3Zj-Y/hqdefault.jpg,480,360,geoffmackley,none
8hhT_S-D7nE,2014-08-21T17:58:48.000Z,UCyo69MRswGNyoIZW-MfE0xw,"Naked feet village kids on the way to Asheten Mariam Monastery, Lalibela",I was really impressed to see kids naked feet on the way to Asheten Mariam Monastery. They were using no shoes at all walking on the mountain on an altitude ...,https://i.ytimg.com/vi/8hhT_S-D7nE/default.jpg,120,90,https://i.ytimg.com/vi/8hhT_S-D7nE/mqdefault.jpg,320,180,https://i.ytimg.com/vi/8hhT_S-D7nE/hqdefault.jpg,480,360,MAOLsuperstar,none
R0CfjPeWw3c,2016-04-29T19:15:45.000Z,UCmtnCTV0SrUPr9Zc4aX03cw,Dinner at Lalibela Ethiopian Restaurant in Toronto,My second time dining at Lalibela Ethiopian Restaurant in Toronto and my third overall time eating Ethiopian food. My friend had just gone to the restroom to ...,https://i.ytimg.com/vi/R0CfjPeWw3c/default.jpg,120,90,https://i.ytimg.com/vi/R0CfjPeWw3c/mqdefault.jpg,320,180,https://i.ytimg.com/vi/R0CfjPeWw3c/hqdefault.jpg,480,360,stenoodie,none
EkPNl3PeGvQ,2018-01-16T18:30:00.000Z,UCWNQoY47Ha8RYW1Ftol92dQ,Lalibela & Degosach Eco Lodage  I  Episode # 12 I Backpacking Africa Travel Vlog HandZaround,"High above the clouds of Lalibela, we spent three nights filming and creating a short documentary film for the Degosach Eco Lodge. This vlog is a behind the ...",https://i.ytimg.com/vi/EkPNl3PeGvQ/default.jpg,120,90,https://i.ytimg.com/vi/EkPNl3PeGvQ/mqdefault.jpg,320,180,https://i.ytimg.com/vi/EkPNl3PeGvQ/hqdefault.jpg,480,360,HandZaround,none
IuQnDh5eMzQ,2016-03-18T22:19:43.000Z,UCzefaSpyKJYpHzYIcd2hDoA,"Once upon a faith in Lalibela, Ethiopia","A 25' documentary about the monolithic churches in Lalibela, Ethiopia, built in the 13th century in order to create a new Jerusalem. Emphasis is on sharing the ...",https://i.ytimg.com/vi/IuQnDh5eMzQ/default.jpg,120,90,https://i.ytimg.com/vi/IuQnDh5eMzQ/mqdefault.jpg,320,180,https://i.ytimg.com/vi/IuQnDh5eMzQ/hqdefault.jpg,480,360,Tito Dupret,none
UsLWoiidI1A,2016-03-11T05:01:26.000Z,UCs8HTlXpPZ36l6wYVVtig2w,Joseph lalibela-  Mark Of The Beast & Dub,Selassie I Soundz.,https://i.ytimg.com/vi/UsLWoiidI1A/default.jpg,120,90,https://i.ytimg.com/vi/UsLWoiidI1A/mqdefault.jpg,320,180,https://i.ytimg.com/vi/UsLWoiidI1A/hqdefault.jpg,480,360,Tiggie Dub,none
lSpm4wMXFb0,2017-11-02T16:46:18.000Z,UCMfLKsD9iIitmdkfJfZ4DSw,Ethiopia ― Rock-hewn Churches of Lalibela: Still in danger due to bad protection strategy,"Ethiopia • The sun/rain protective shields on the church are creating devastating side effects on the rock-hewn churches of Lalibela, Amhara Mass Media Agency ...",https://i.ytimg.com/vi/lSpm4wMXFb0/default.jpg,120,90,https://i.ytimg.com/vi/lSpm4wMXFb0/mqdefault.jpg,320,180,https://i.ytimg.com/vi/lSpm4wMXFb0/hqdefault.jpg,480,360,Ethiopia Online Videos,none
hTzugkbH6fs,2013-05-20T12:59:35.000Z,UCNQ_P-V5HmFdwbICgHH9kNg,One of Eleven Monolithic Churches  Church of St. George in Lalibela,Subscribe For More VIdeos: http://goo.gl/CnuhTj.,https://i.ytimg.com/vi/hTzugkbH6fs/default.jpg,120,90,https://i.ytimg.com/vi/hTzugkbH6fs/mqdefault.jpg,320,180,https://i.ytimg.com/vi/hTzugkbH6fs/hqdefault.jpg,480,360,Pastimers - World's Best & Worst,none
