video_id,publishedAt,channelId,title,description,thumbnails.default.url,thumbnails.default.width,thumbnails.default.height,thumbnails.medium.url,thumbnails.medium.width,thumbnails.medium.height,thumbnails.high.url,thumbnails.high.width,thumbnails.high.height,channelTitle,liveBroadcastContent
Ezof_Ba4jUI,2012-06-28T11:55:46.000Z,UC3kiSGI78ZNzVs6_1ev2qhA,"Ethiopia trip dec 2009 - ( Addis Abeba, Gonder, Lalibela , Simiens Nationalpark )",,https://i.ytimg.com/vi/Ezof_Ba4jUI/default.jpg,120,90,https://i.ytimg.com/vi/Ezof_Ba4jUI/mqdefault.jpg,320,180,https://i.ytimg.com/vi/Ezof_Ba4jUI/hqdefault.jpg,480,360,Bjurlemyr,none
thyTM_ob2CE,2011-11-09T08:29:15.000Z,UCE9n8xhwHjLOIvnviRtblvQ,Misa en Lalibela 1,"Cánticos de la misa del domingo en la iglesia de San Jorge (Lalibela, Etiopía).",https://i.ytimg.com/vi/thyTM_ob2CE/default.jpg,120,90,https://i.ytimg.com/vi/thyTM_ob2CE/mqdefault.jpg,320,180,https://i.ytimg.com/vi/thyTM_ob2CE/hqdefault.jpg,480,360,javiertrianamartinez,none
ywnDE-hXN7Y,2017-04-20T13:46:03.000Z,UCDKqEKA1KHHBKSjSpSEr0Tg,Lalibela Wonders  with Guide Addisalem 2017,Contact Guide Addisalem to arrange the perfect tailored tour of Lalibela: addisalem_lalibela@yahoo.com Tel: 0913902253.,https://i.ytimg.com/vi/ywnDE-hXN7Y/default.jpg,120,90,https://i.ytimg.com/vi/ywnDE-hXN7Y/mqdefault.jpg,320,180,https://i.ytimg.com/vi/ywnDE-hXN7Y/hqdefault.jpg,480,360,Legassi Gardens,none
MMeGkOuaWY4,2016-06-05T14:17:02.000Z,UCKXfZSbVOtA6BaiZXSExVYA,sacerdotes danzando Gedda en Lalibela,"Celebración de la navidad etiope en Lalibela, junto a la iglesia de Bet Mariam tras una noche de vigilia.",https://i.ytimg.com/vi/MMeGkOuaWY4/default.jpg,120,90,https://i.ytimg.com/vi/MMeGkOuaWY4/mqdefault.jpg,320,180,https://i.ytimg.com/vi/MMeGkOuaWY4/hqdefault.jpg,480,360,nosvamosdeviaje.com,none
cbdi9hunYH0,2012-06-28T12:37:09.000Z,UCNM0li0Zs-sdupfLl_U4JUg,Pharaoh Overlord - Lalibela @ Dunajam 2012,6/8 Lalibela.,https://i.ytimg.com/vi/cbdi9hunYH0/default.jpg,120,90,https://i.ytimg.com/vi/cbdi9hunYH0/mqdefault.jpg,320,180,https://i.ytimg.com/vi/cbdi9hunYH0/hqdefault.jpg,480,360,Juho Hamari,none
59iG2pPRJ_Q,2016-05-26T11:59:25.000Z,UCAOFbDTXHzDGWvNFpAakhCg,Lalibela Hudad - Lalibela Eco Trekking,"The lalibela hudad eco lodge located 3300m in the mountain above lalibela, we will organize a day trip and overnight trek to hudad. For more visit our website ...",https://i.ytimg.com/vi/59iG2pPRJ_Q/default.jpg,120,90,https://i.ytimg.com/vi/59iG2pPRJ_Q/mqdefault.jpg,320,180,https://i.ytimg.com/vi/59iG2pPRJ_Q/hqdefault.jpg,480,360,molla kassaw,none
zPBnZqBdaeg,2014-02-09T11:36:19.000Z,UCZ5L1YikFmJjnFk-TDQGviQ,Ethiopie 2 ème partie. De Lalibela à Axum,"Ethiopie 2 ème partie. De Lalibela à Axum via Mekele et son marché. Visites d'églises. Panoramas de montagnes, plateaux et pâturages.",https://i.ytimg.com/vi/zPBnZqBdaeg/default.jpg,120,90,https://i.ytimg.com/vi/zPBnZqBdaeg/mqdefault.jpg,320,180,https://i.ytimg.com/vi/zPBnZqBdaeg/hqdefault.jpg,480,360,Daniel Coyaud,none
YsIpfi486cQ,2012-01-17T19:01:16.000Z,UCEXgBmTQYm0Nl2G8Y7JIBpg,"Noël Ethiopien, rituel à Lalibela",Rituel dans l'église de Bete Medhane Alem à Lalibela. La veille de Noël.,https://i.ytimg.com/vi/YsIpfi486cQ/default.jpg,120,90,https://i.ytimg.com/vi/YsIpfi486cQ/mqdefault.jpg,320,180,https://i.ytimg.com/vi/YsIpfi486cQ/hqdefault.jpg,480,360,Tekenessi,none
soFVc6wFo4g,2011-08-29T21:37:34.000Z,UCcPo7r-MrHxKQkeDZabQk4w,Etiopia: il Timkat a Lalibela,Descrizione viaggio e tragitto sono in http://www.inognidove.it/etiopia Merita un viaggio a parte il periodo del Timkat: la più importante festa ortodossa in Etiopia: ...,https://i.ytimg.com/vi/soFVc6wFo4g/default.jpg,120,90,https://i.ytimg.com/vi/soFVc6wFo4g/mqdefault.jpg,320,180,https://i.ytimg.com/vi/soFVc6wFo4g/hqdefault.jpg,480,360,369Lux,none
bpON6zejqkw,2013-03-06T12:07:57.000Z,UC2BRsvk1mWn8qfn7AWmX5rw,"Walking outside Bet Merkorios Church, Lalibela Ethiopia","Walking outside Bet Merkorios Church, Lalibela Ethiopia.",https://i.ytimg.com/vi/bpON6zejqkw/default.jpg,120,90,https://i.ytimg.com/vi/bpON6zejqkw/mqdefault.jpg,320,180,https://i.ytimg.com/vi/bpON6zejqkw/hqdefault.jpg,480,360,João Leitão,none
Yj53FE2Ydh8,2012-12-27T07:45:18.000Z,UCiOIWiKE2rmYO7A8OWLRVJQ,ቤተ ጊዮርጊስ ላሊበላ lalibela,,https://i.ytimg.com/vi/Yj53FE2Ydh8/default.jpg,120,90,https://i.ytimg.com/vi/Yj53FE2Ydh8/mqdefault.jpg,320,180,https://i.ytimg.com/vi/Yj53FE2Ydh8/hqdefault.jpg,480,360,ደቂቀ ናቡቴ,none
-sCXu_nTCTo,2018-01-12T15:01:26.000Z,UCflUSWaaEAGFtFmrqTi44jA,Muslim + quran = lalibela was Ethiopian create islam not Saudi,Quran book # Biblical # lalibela # born same day jesus did !,https://i.ytimg.com/vi/-sCXu_nTCTo/default.jpg,120,90,https://i.ytimg.com/vi/-sCXu_nTCTo/mqdefault.jpg,320,180,https://i.ytimg.com/vi/-sCXu_nTCTo/hqdefault.jpg,480,360,Mac Sketch,none
-OPmpDhDsBw,2008-12-31T07:36:17.000Z,UCItAMwCzhJLRtXt_GEV8sWA,Lalibela's Bet Gabriel-Rufael,"Images from a guided tour of Bet Gabriel-Rufael (the house of Gabriel-Raphael) in Lalibela, Ethiopia. This structure is unique among the 12th and 13th century ...",https://i.ytimg.com/vi/-OPmpDhDsBw/default.jpg,120,90,https://i.ytimg.com/vi/-OPmpDhDsBw/mqdefault.jpg,320,180,https://i.ytimg.com/vi/-OPmpDhDsBw/hqdefault.jpg,480,360,Carl Davis,none
2REb-5bxbFY,2014-06-24T05:16:42.000Z,UCt2yxX9jhtBEapmep_K468A,Lalibela's Amazing Rock-Hewn Churches,"The amazing churches of Lalibela. Some background noise, sorry. Not home. http://www.sacred-destinations.com/ethiopia/lalibela ...",https://i.ytimg.com/vi/2REb-5bxbFY/default.jpg,120,90,https://i.ytimg.com/vi/2REb-5bxbFY/mqdefault.jpg,320,180,https://i.ytimg.com/vi/2REb-5bxbFY/hqdefault.jpg,480,360,cfapps7865,none
e_Gy74FBxw0,2017-02-28T01:27:31.000Z,UCP_A9OU2BaABI-7hpJOYeQw,Lalibela Bts,,https://i.ytimg.com/vi/e_Gy74FBxw0/default.jpg,120,90,https://i.ytimg.com/vi/e_Gy74FBxw0/mqdefault.jpg,320,180,https://i.ytimg.com/vi/e_Gy74FBxw0/hqdefault.jpg,480,360,Nochlate Studios,none
YIV-j5daLI8,2014-12-16T10:16:12.000Z,UCabccIY1m-HLrQxDVXh6BFw,"Explorator en Ethiopie : Lalibela ""des racines et des ailes""",,https://i.ytimg.com/vi/YIV-j5daLI8/default.jpg,120,90,https://i.ytimg.com/vi/YIV-j5daLI8/mqdefault.jpg,320,180,https://i.ytimg.com/vi/YIV-j5daLI8/hqdefault.jpg,480,360,Explorator Voyages,none
BYjgj8bmjV4,2017-01-09T08:57:37.000Z,UCDNqYGZJuFvGuWYY0F8FEGg,lalibela in 3D,"The Church of St. George (Amharic: Bete Giyorgis?) is one of eleven monolithic churches in Lalibela, a city in the Amhara Region of Ethiopia. Originally named ...",https://i.ytimg.com/vi/BYjgj8bmjV4/default.jpg,120,90,https://i.ytimg.com/vi/BYjgj8bmjV4/mqdefault.jpg,320,180,https://i.ytimg.com/vi/BYjgj8bmjV4/hqdefault.jpg,480,360,Tesfahun Maru,none
JTr0jUfDrXI,2012-01-01T19:33:31.000Z,UCJLKIBaSSC5j9f6oC9aCW6w,The Church of Saint George - Lalibela,"The Church of Saint George, one of many churches hewn into the rocky hills of Lalibela.",https://i.ytimg.com/vi/JTr0jUfDrXI/default.jpg,120,90,https://i.ytimg.com/vi/JTr0jUfDrXI/mqdefault.jpg,320,180,https://i.ytimg.com/vi/JTr0jUfDrXI/hqdefault.jpg,480,360,mokocharlie,none
x2kueMyHauw,2015-06-13T17:31:37.000Z,UCZ0lBTvCctutXxL462pe-RQ,"asheten mariam,lalibela",,https://i.ytimg.com/vi/x2kueMyHauw/default.jpg,120,90,https://i.ytimg.com/vi/x2kueMyHauw/mqdefault.jpg,320,180,https://i.ytimg.com/vi/x2kueMyHauw/hqdefault.jpg,480,360,DEBOL DFP,none
lCqAVDTclXo,2011-07-21T23:04:21.000Z,UCazvIAiEn1RkQ7TozMzBTGg,"Mercado Lalibela, Etiopia.","CAMINANDO HACIA EL MERCADO DE LALIBELA, ETIOPIA.",https://i.ytimg.com/vi/lCqAVDTclXo/default.jpg,120,90,https://i.ytimg.com/vi/lCqAVDTclXo/mqdefault.jpg,320,180,https://i.ytimg.com/vi/lCqAVDTclXo/hqdefault.jpg,480,360,olezna,none
HtmdVT5QcXs,2018-02-26T14:08:14.000Z,UCUSbUqkZtgaBrE76S_M3rgQ,"Rock Hewn Churches of Lalibela, Ethiopia",Ancient rock hewn medieval churches of Lalibela Ethiopia.,https://i.ytimg.com/vi/HtmdVT5QcXs/default.jpg,120,90,https://i.ytimg.com/vi/HtmdVT5QcXs/mqdefault.jpg,320,180,https://i.ytimg.com/vi/HtmdVT5QcXs/hqdefault.jpg,480,360,Kenneth Mungai,none
Ssf0Qiz6z90,2015-09-04T09:20:17.000Z,UCaRUrNSPXQuBxU_OIQCkGcg,"Nhatty Man & The Lalibelas   አይከፋ ገፅሽ (አንድ ነገር)  ""Andneger"" ናቲ ማን",ለዓይኔ ብርቁን ንቄው አንቺን ብዬ ሁሉን ትቼው ያለኝን ጭኜ አሟጥጬ እስክመጣ ላይሽ ቆርጬ አንድ ነገር ይዤ እስክዘልቅ...,https://i.ytimg.com/vi/Ssf0Qiz6z90/default.jpg,120,90,https://i.ytimg.com/vi/Ssf0Qiz6z90/mqdefault.jpg,320,180,https://i.ytimg.com/vi/Ssf0Qiz6z90/hqdefault.jpg,480,360,Nhatty Man,none
QzLEXD60_6w,2018-07-09T17:41:25.000Z,UCbPQebut6ev9aEYUY62Xd6A,Ethiopia ሰበር ዜና ዛሬ  መታየት ያለበት,"Ethiopia ሰበር ዜና ዛሬ መታየት ያለበት !Ethiopia, in the Horn of Africa, is a rugged, landlocked coun split by the Great Rift Valley. With archaeological finds dating...",https://i.ytimg.com/vi/QzLEXD60_6w/default.jpg,120,90,https://i.ytimg.com/vi/QzLEXD60_6w/mqdefault.jpg,320,180,https://i.ytimg.com/vi/QzLEXD60_6w/hqdefault.jpg,480,360,Ethio information,none
8FTI34vMDrk,2018-07-10T06:02:48.000Z,UCADXAQ-WsE6YusaG2FC23BQ,"BBN Daily Ethiopian News July 9, 2018","Check Out Ethiopian News, New Ethiopian Musics, Ethiopian Comedy and More Ethiopian Videos by Subscribing Here: https://goo.gl/kATImk Unauthorized use, ...",https://i.ytimg.com/vi/8FTI34vMDrk/default.jpg,120,90,https://i.ytimg.com/vi/8FTI34vMDrk/mqdefault.jpg,320,180,https://i.ytimg.com/vi/8FTI34vMDrk/hqdefault.jpg,480,360,tenaadam,none
AULgwsHCDug,2018-07-09T01:23:26.000Z,UCADXAQ-WsE6YusaG2FC23BQ,Mesay Mekonenn on Ethiopia & Eritrea | Dr Abiy Ahmed | Isaias Afwerki,"Check Out Ethiopian News, New Ethiopian Musics, Ethiopian Comedy and More Ethiopian Videos by Subscribing Here: https://goo.gl/kATImk Unauthorized use, ...",https://i.ytimg.com/vi/AULgwsHCDug/default.jpg,120,90,https://i.ytimg.com/vi/AULgwsHCDug/mqdefault.jpg,320,180,https://i.ytimg.com/vi/AULgwsHCDug/hqdefault.jpg,480,360,tenaadam,none
XOhEnLhj5cE,2018-07-14T20:46:09.000Z,UCLqOfbLG-ov6S5Aa-Zp1Z4g,Ethiopia: ኢሳያስና ዶ:ር አብይ በአዋሳ ሃይሌ ሆቴል | Camel presented to President Isaias Afwerki by Dr Abiy Ahmed,"Ethiopia News, Ethiopian Music, Ethiopian Comedy, Ethiopian Wedding and All Things Ethiopian Subscribe Here: https://goo.gl/UYa7Ih Ethiopia Country in East ...",https://i.ytimg.com/vi/XOhEnLhj5cE/default.jpg,120,90,https://i.ytimg.com/vi/XOhEnLhj5cE/mqdefault.jpg,320,180,https://i.ytimg.com/vi/XOhEnLhj5cE/hqdefault.jpg,480,360,All Things ኢትዮጵያ Ethiopia,none
GHSeYpPWLho,2018-07-06T14:50:03.000Z,UCADXAQ-WsE6YusaG2FC23BQ,PM Dr Abiy Ahmed QA with Ethiopian Parliament,"Check Out Ethiopian News, New Ethiopian Musics, Ethiopian Comedy and More Ethiopian Videos by Subscribing Here: https://goo.gl/kATImk Unauthorized use, ...",https://i.ytimg.com/vi/GHSeYpPWLho/default.jpg,120,90,https://i.ytimg.com/vi/GHSeYpPWLho/mqdefault.jpg,320,180,https://i.ytimg.com/vi/GHSeYpPWLho/hqdefault.jpg,480,360,tenaadam,none
JYllAgP5X80,2018-07-10T16:15:10.000Z,UCADXAQ-WsE6YusaG2FC23BQ,"Voice of Amhara Daily Ethiopian News July 10, 2018","Check Out Ethiopian News, New Ethiopian Musics, Ethiopian Comedy and More Ethiopian Videos by Subscribing Here: https://goo.gl/kATImk Unauthorized use, ...",https://i.ytimg.com/vi/JYllAgP5X80/default.jpg,120,90,https://i.ytimg.com/vi/JYllAgP5X80/mqdefault.jpg,320,180,https://i.ytimg.com/vi/JYllAgP5X80/hqdefault.jpg,480,360,tenaadam,none
RnzmNnhwodc,2018-07-09T17:28:51.000Z,UCADXAQ-WsE6YusaG2FC23BQ,"Ethiopian Daily News Digest July 9, 2018","Check Out Ethiopian News, New Ethiopian Musics, Ethiopian Comedy and More Ethiopian Videos by Subscribing Here: https://goo.gl/kATImk Unauthorized use, ...",https://i.ytimg.com/vi/RnzmNnhwodc/default.jpg,120,90,https://i.ytimg.com/vi/RnzmNnhwodc/mqdefault.jpg,320,180,https://i.ytimg.com/vi/RnzmNnhwodc/hqdefault.jpg,480,360,tenaadam,none
rz_PeJZl6GA,2018-07-14T17:40:53.000Z,UCADXAQ-WsE6YusaG2FC23BQ,"Zehabesha Daily Ethiopian News July 14, 2018","Daily Ethiopian & Eritrean News Check Out Ethiopian News, New Ethiopian Musics, Ethiopian Comedy and More Ethiopian Videos by Subscribing Here: ...",https://i.ytimg.com/vi/rz_PeJZl6GA/default.jpg,120,90,https://i.ytimg.com/vi/rz_PeJZl6GA/mqdefault.jpg,320,180,https://i.ytimg.com/vi/rz_PeJZl6GA/hqdefault.jpg,480,360,tenaadam,none
cN5XpVoL_2k,2018-07-11T04:00:01.000Z,UCADXAQ-WsE6YusaG2FC23BQ,Press Conference on PM Dr Abiy Ahmed's Los Angels Visit,"Check Out Ethiopian News, New Ethiopian Musics, Ethiopian Comedy and More Ethiopian Videos by Subscribing Here: https://goo.gl/kATImk Unauthorized use, ...",https://i.ytimg.com/vi/cN5XpVoL_2k/default.jpg,120,90,https://i.ytimg.com/vi/cN5XpVoL_2k/mqdefault.jpg,320,180,https://i.ytimg.com/vi/cN5XpVoL_2k/hqdefault.jpg,480,360,tenaadam,none
oVIXL4ZYo-E,2018-07-06T17:26:55.000Z,UCxMUNLpBqLTzPzdFKtfbDVw,ዶ/ር አብይ አህመድ የበጀት አጠቃቀም ላይ ማብራሪያ ሰጡ Dr. Abiy Ahmed,Ethiopian prime minister Dr. Abiy Ahmed has presented suggestions on the government budget የፌደራል መንግስት በጀትን በተመለከተ ማብራሪያ ለመስጠት ዛሬ...,https://i.ytimg.com/vi/oVIXL4ZYo-E/default.jpg,120,90,https://i.ytimg.com/vi/oVIXL4ZYo-E/mqdefault.jpg,320,180,https://i.ytimg.com/vi/oVIXL4ZYo-E/hqdefault.jpg,480,360,Fikre Selam,none
1MNoK1VkdVg,2018-07-14T20:44:55.000Z,UCADXAQ-WsE6YusaG2FC23BQ,Siefu on EBS: ዶ/ር አብይ በቤተመንግስት እምባዋን ከጠረጉላት እናት ጋር ሰይፉ ያደረገው ቆይታ,"Check Out Ethiopian News, New Ethiopian Musics, Ethiopian Comedy and More Ethiopian Videos by Subscribing Here: https://goo.gl/kATImk Unauthorized use, ...",https://i.ytimg.com/vi/1MNoK1VkdVg/default.jpg,120,90,https://i.ytimg.com/vi/1MNoK1VkdVg/mqdefault.jpg,320,180,https://i.ytimg.com/vi/1MNoK1VkdVg/hqdefault.jpg,480,360,tenaadam,none
x35bHoJN2Ws,2018-07-11T14:44:17.000Z,UCADXAQ-WsE6YusaG2FC23BQ,"Zehabesha Breaking News July 11, 2018","Check Out Ethiopian News, New Ethiopian Musics, Ethiopian Comedy and More Ethiopian Videos by Subscribing Here: https://goo.gl/kATImk Unauthorized use, ...",https://i.ytimg.com/vi/x35bHoJN2Ws/default.jpg,120,90,https://i.ytimg.com/vi/x35bHoJN2Ws/mqdefault.jpg,320,180,https://i.ytimg.com/vi/x35bHoJN2Ws/hqdefault.jpg,480,360,tenaadam,none
bu_hlE6_Pao,2018-07-09T13:59:41.000Z,UCADXAQ-WsE6YusaG2FC23BQ,"Hiber Radio Daily Ethiopian News July 9, 2018","Check Out Ethiopian News, New Ethiopian Musics, Ethiopian Comedy and More Ethiopian Videos by Subscribing Here: https://goo.gl/kATImk Unauthorized use, ...",https://i.ytimg.com/vi/bu_hlE6_Pao/default.jpg,120,90,https://i.ytimg.com/vi/bu_hlE6_Pao/mqdefault.jpg,320,180,https://i.ytimg.com/vi/bu_hlE6_Pao/hqdefault.jpg,480,360,tenaadam,none
HdtDykA0KCE,2018-07-10T00:46:52.000Z,UCADXAQ-WsE6YusaG2FC23BQ,Shukshukta (ሹክሹክታ) -  ኤምባሲው፡ የዶ/ር አብይን የዲሲ ጉዞ ማሰናከል ሸፍጥ | Kassa TekleBerhan  | Dr Abiy Ahmed,"Check Out Ethiopian News, New Ethiopian Musics, Ethiopian Comedy and More Ethiopian Videos by Subscribing Here: https://goo.gl/kATImk Unauthorized use, ...",https://i.ytimg.com/vi/HdtDykA0KCE/default.jpg,120,90,https://i.ytimg.com/vi/HdtDykA0KCE/mqdefault.jpg,320,180,https://i.ytimg.com/vi/HdtDykA0KCE/hqdefault.jpg,480,360,tenaadam,none
gpQYAfkPlZY,2018-07-11T01:43:40.000Z,UCADXAQ-WsE6YusaG2FC23BQ,"BBN Daily Ethiopian News July 10, 2018","Check Out Ethiopian News, New Ethiopian Musics, Ethiopian Comedy and More Ethiopian Videos by Subscribing Here: https://goo.gl/kATImk Unauthorized use, ...",https://i.ytimg.com/vi/gpQYAfkPlZY/default.jpg,120,90,https://i.ytimg.com/vi/gpQYAfkPlZY/mqdefault.jpg,320,180,https://i.ytimg.com/vi/gpQYAfkPlZY/hqdefault.jpg,480,360,tenaadam,none
U_57t3yM05Q,2018-07-08T23:09:48.000Z,UCADXAQ-WsE6YusaG2FC23BQ,VOA Eneweyaye (እንወያይ) - Ethiopia vs Eritrea | Dr Abiy Ahmed | Isaias Afwerki | Mulu Solomon,"Check Out Ethiopian News, New Ethiopian Musics, Ethiopian Comedy and More Ethiopian Videos by Subscribing Here: https://goo.gl/kATImk Unauthorized use, ...",https://i.ytimg.com/vi/U_57t3yM05Q/default.jpg,120,90,https://i.ytimg.com/vi/U_57t3yM05Q/mqdefault.jpg,320,180,https://i.ytimg.com/vi/U_57t3yM05Q/hqdefault.jpg,480,360,tenaadam,none
pWOZ1bl978w,2018-07-14T09:16:41.000Z,UCADXAQ-WsE6YusaG2FC23BQ,"Ethiopia: ኢሳያስ አፈወርቂ አራት ኪሎ ቤተመንግስት ሲገቡ |  Isaias Afwerki  at National Palace Addis Ababa, Ethiopia","ኢሳያስ አፈወርቂ አራት ኪሎ ቤተመንግስት ሲገቡ | Isaias Afeweki at National Palace Addis Ababa, Ethiopia. Thousands of Ethiopians young and old lined up from...",https://i.ytimg.com/vi/pWOZ1bl978w/default.jpg,120,90,https://i.ytimg.com/vi/pWOZ1bl978w/mqdefault.jpg,320,180,https://i.ytimg.com/vi/pWOZ1bl978w/hqdefault.jpg,480,360,tenaadam,none
BMJ58z19do8,2018-07-09T11:52:16.000Z,UCADXAQ-WsE6YusaG2FC23BQ,"ETV Special News July 9, 2018 |  Ethiopia | Eritrea","Check Out Ethiopian News, New Ethiopian Musics, Ethiopian Comedy and More Ethiopian Videos by Subscribing Here: https://goo.gl/kATImk Unauthorized use, ...",https://i.ytimg.com/vi/BMJ58z19do8/default.jpg,120,90,https://i.ytimg.com/vi/BMJ58z19do8/mqdefault.jpg,320,180,https://i.ytimg.com/vi/BMJ58z19do8/hqdefault.jpg,480,360,tenaadam,none
IQaDSqSbgPM,2018-07-10T14:22:26.000Z,UCADXAQ-WsE6YusaG2FC23BQ,"Hiber Special Ethiopian News July 10, 2018","Check Out Ethiopian News, New Ethiopian Musics, Ethiopian Comedy and More Ethiopian Videos by Subscribing Here: https://goo.gl/kATImk Unauthorized use, ...",https://i.ytimg.com/vi/IQaDSqSbgPM/default.jpg,120,90,https://i.ytimg.com/vi/IQaDSqSbgPM/mqdefault.jpg,320,180,https://i.ytimg.com/vi/IQaDSqSbgPM/hqdefault.jpg,480,360,tenaadam,none
Iqkun1Zgy20,2018-07-13T23:04:08.000Z,UCADXAQ-WsE6YusaG2FC23BQ,Ermias Legesse's Open Letter to PM Dr Abiy Ahmed,"Check Out Ethiopian News, New Ethiopian Musics, Ethiopian Comedy and More Ethiopian Videos by Subscribing Here: https://goo.gl/kATImk Unauthorized use, ...",https://i.ytimg.com/vi/Iqkun1Zgy20/default.jpg,120,90,https://i.ytimg.com/vi/Iqkun1Zgy20/mqdefault.jpg,320,180,https://i.ytimg.com/vi/Iqkun1Zgy20/hqdefault.jpg,480,360,tenaadam,none
o8yYzkKYJgE,2018-07-06T13:51:22.000Z,UCADXAQ-WsE6YusaG2FC23BQ,Power Struggle Between TPLF and OPDO  Junedin Sado  -   SBS Amharic,"Check Out Ethiopian News, New Ethiopian Musics, Ethiopian Comedy and More Ethiopian Videos by Subscribing Here: https://goo.gl/kATImk Unauthorized use, ...",https://i.ytimg.com/vi/o8yYzkKYJgE/default.jpg,120,90,https://i.ytimg.com/vi/o8yYzkKYJgE/mqdefault.jpg,320,180,https://i.ytimg.com/vi/o8yYzkKYJgE/hqdefault.jpg,480,360,tenaadam,none
zOPQLIdj3xQ,2018-07-11T08:00:07.000Z,UCADXAQ-WsE6YusaG2FC23BQ,Must Watch Story -  Ethiopia: ዘግናኙ የሴቶች እና የወንዶች እስር ቤት ፡ የታራሚዎች አሳዛኝ ታሪኮች,"Check Out Ethiopian News, New Ethiopian Musics, Ethiopian Comedy and More Ethiopian Videos by Subscribing Here: https://goo.gl/kATImk Unauthorized use, ...",https://i.ytimg.com/vi/zOPQLIdj3xQ/default.jpg,120,90,https://i.ytimg.com/vi/zOPQLIdj3xQ/mqdefault.jpg,320,180,https://i.ytimg.com/vi/zOPQLIdj3xQ/hqdefault.jpg,480,360,tenaadam,none
qj2QTiuaTmM,2018-07-13T14:11:52.000Z,UCADXAQ-WsE6YusaG2FC23BQ,"Zehabesha Daily Ethiopian News July 13, 2018","Check Out Ethiopian News, New Ethiopian Musics, Ethiopian Comedy and More Ethiopian Videos by Subscribing Here: https://goo.gl/kATImk Unauthorized use, ...",https://i.ytimg.com/vi/qj2QTiuaTmM/default.jpg,120,90,https://i.ytimg.com/vi/qj2QTiuaTmM/mqdefault.jpg,320,180,https://i.ytimg.com/vi/qj2QTiuaTmM/hqdefault.jpg,480,360,tenaadam,none
8EOptdJ3Kag,2018-07-11T17:31:47.000Z,UCADXAQ-WsE6YusaG2FC23BQ,"Hiber News Analysis July 12, 2018","Check Out Ethiopian News, New Ethiopian Musics, Ethiopian Comedy and More Ethiopian Videos by Subscribing Here: https://goo.gl/kATImk Unauthorized use, ...",https://i.ytimg.com/vi/8EOptdJ3Kag/default.jpg,120,90,https://i.ytimg.com/vi/8EOptdJ3Kag/mqdefault.jpg,320,180,https://i.ytimg.com/vi/8EOptdJ3Kag/hqdefault.jpg,480,360,tenaadam,none
h-sF7ru05nA,2018-07-10T18:18:35.000Z,UCbPQebut6ev9aEYUY62Xd6A,Ethiopia መጠንቀቅ ያስፈልጋል ለሚመለከተዉ ሁላ እነ አሉላ TPL  አደገኞች ናቸዉ,Ethiopia መጠንቀቅ ያስፈልጋል ለሚመለከተዉ ሁላ እነ አሉላ TPL አደገኞች ናቸዉ Ethio information | Hiber Radio | ESAT | ETHSAT |...,https://i.ytimg.com/vi/h-sF7ru05nA/default.jpg,120,90,https://i.ytimg.com/vi/h-sF7ru05nA/mqdefault.jpg,320,180,https://i.ytimg.com/vi/h-sF7ru05nA/hqdefault.jpg,480,360,Ethio information,none
LKibzzKqXwg,2018-07-06T17:57:14.000Z,UCADXAQ-WsE6YusaG2FC23BQ,TPLF EXPOSED: Ethio - Sudan Boarder,"Check Out Ethiopian News, New Ethiopian Musics, Ethiopian Comedy and More Ethiopian Videos by Subscribing Here: https://goo.gl/kATImk Unauthorized use, ...",https://i.ytimg.com/vi/LKibzzKqXwg/default.jpg,120,90,https://i.ytimg.com/vi/LKibzzKqXwg/mqdefault.jpg,320,180,https://i.ytimg.com/vi/LKibzzKqXwg/hqdefault.jpg,480,360,tenaadam,none
w6xQ946A2OQ,2018-07-13T01:40:34.000Z,UCADXAQ-WsE6YusaG2FC23BQ,Mesay Mekonenn on Amhara Resistance | Col Demeke Zewedu | Gonder  | ሐምሌ 5,"Check Out Ethiopian News, New Ethiopian Musics, Ethiopian Comedy and More Ethiopian Videos by Subscribing Here: https://goo.gl/kATImk Unauthorized use, ...",https://i.ytimg.com/vi/w6xQ946A2OQ/default.jpg,120,90,https://i.ytimg.com/vi/w6xQ946A2OQ/mqdefault.jpg,320,180,https://i.ytimg.com/vi/w6xQ946A2OQ/hqdefault.jpg,480,360,tenaadam,none
fQ9l0YiQ9iU,2018-07-13T16:42:14.000Z,UCLqOfbLG-ov6S5Aa-Zp1Z4g,Ethiopia ደብረማርቆስም ይሁን አዲስ አበባ በረከት ሞቷል | Bereket Simon | Dr Abiy Ahmed | Debre Markos Gojam,"Ethiopia News, Ethiopian Music, Ethiopian Comedy, Ethiopian Wedding and All Things Ethiopian Subscribe Here: https://goo.gl/UYa7Ih Ethiopia Country in East ...",https://i.ytimg.com/vi/fQ9l0YiQ9iU/default.jpg,120,90,https://i.ytimg.com/vi/fQ9l0YiQ9iU/mqdefault.jpg,320,180,https://i.ytimg.com/vi/fQ9l0YiQ9iU/hqdefault.jpg,480,360,All Things ኢትዮጵያ Ethiopia,none
Z6zQWJGUOvI,2018-07-05T14:43:39.000Z,UCADXAQ-WsE6YusaG2FC23BQ,TPLF vs Dr Abiy Ahmed - Must Watch,"Check Out Ethiopian News, New Ethiopian Musics, Ethiopian Comedy and More Ethiopian Videos by Subscribing Here: https://goo.gl/kATImk Unauthorized use, ...",https://i.ytimg.com/vi/Z6zQWJGUOvI/default.jpg,120,90,https://i.ytimg.com/vi/Z6zQWJGUOvI/mqdefault.jpg,320,180,https://i.ytimg.com/vi/Z6zQWJGUOvI/hqdefault.jpg,480,360,tenaadam,none
KMoxC9f81MY,2018-07-14T08:54:57.000Z,UCADXAQ-WsE6YusaG2FC23BQ,Ethiopia: ኢሳያስ አፈወርቂ በአዲስ አበባ ጎዳናዎች  ሲያልፍ | Isaias Afwerki  in addis ababa,"Thousands of Ethiopians young and old lined up from Bole International Airport to The President's Palace singing, cheering & joyfully welcoming President ...",https://i.ytimg.com/vi/KMoxC9f81MY/default.jpg,120,90,https://i.ytimg.com/vi/KMoxC9f81MY/mqdefault.jpg,320,180,https://i.ytimg.com/vi/KMoxC9f81MY/hqdefault.jpg,480,360,tenaadam,none
wd7YdU1GvCo,2018-07-12T17:31:02.000Z,UCADXAQ-WsE6YusaG2FC23BQ,"Zehabesha Daily Ethiopian News July 12, 2018","Check Out Ethiopian News, New Ethiopian Musics, Ethiopian Comedy and More Ethiopian Videos by Subscribing Here: https://goo.gl/kATImk Unauthorized use, ...",https://i.ytimg.com/vi/wd7YdU1GvCo/default.jpg,120,90,https://i.ytimg.com/vi/wd7YdU1GvCo/mqdefault.jpg,320,180,https://i.ytimg.com/vi/wd7YdU1GvCo/hqdefault.jpg,480,360,tenaadam,none
SA-BJ5stY6U,2018-07-09T17:12:26.000Z,UCADXAQ-WsE6YusaG2FC23BQ,"NEW!! Dr Abiy Speech in Asmera, Eritrea - HD","Check Out Ethiopian News, New Ethiopian Musics, Ethiopian Comedy and More Ethiopian Videos by Subscribing Here: https://goo.gl/kATImk Unauthorized use, ...",https://i.ytimg.com/vi/SA-BJ5stY6U/default.jpg,120,90,https://i.ytimg.com/vi/SA-BJ5stY6U/mqdefault.jpg,320,180,https://i.ytimg.com/vi/SA-BJ5stY6U/hqdefault.jpg,480,360,tenaadam,none
dNWNE1Z4yc4,2018-07-11T22:41:22.000Z,UCADXAQ-WsE6YusaG2FC23BQ,Breaking News [ሰበር ዜና]  -  Abdi Illey አብዲ ኢሌ ደህንነቱ ጌታቸው አሰፋን አጋለጠው | Dr Abiy Ahmed,"Check Out Ethiopian News, New Ethiopian Musics, Ethiopian Comedy and More Ethiopian Videos by Subscribing Here: https://goo.gl/kATImk Unauthorized use, ...",https://i.ytimg.com/vi/dNWNE1Z4yc4/default.jpg,120,90,https://i.ytimg.com/vi/dNWNE1Z4yc4/mqdefault.jpg,320,180,https://i.ytimg.com/vi/dNWNE1Z4yc4/hqdefault.jpg,480,360,tenaadam,none
8ntkNtVqGlQ,2018-07-02T04:14:35.000Z,UCADXAQ-WsE6YusaG2FC23BQ,"ESFNA 2018 Dallas, Texas  Opening Day","Check Out Ethiopian News, New Ethiopian Musics, Ethiopian Comedy and More Ethiopian Videos by Subscribing Here: https://goo.gl/kATImk Unauthorized use, ...",https://i.ytimg.com/vi/8ntkNtVqGlQ/default.jpg,120,90,https://i.ytimg.com/vi/8ntkNtVqGlQ/mqdefault.jpg,320,180,https://i.ytimg.com/vi/8ntkNtVqGlQ/hqdefault.jpg,480,360,tenaadam,none
O8rZfY4wg-8,2018-07-10T15:20:04.000Z,UCADXAQ-WsE6YusaG2FC23BQ,"Ethiopian Daily News Digest: ETV News  July 10, 2018 - Ethiopia & Eritrea","Check Out Ethiopian News, New Ethiopian Musics, Ethiopian Comedy and More Ethiopian Videos by Subscribing Here: https://goo.gl/kATImk Unauthorized use, ...",https://i.ytimg.com/vi/O8rZfY4wg-8/default.jpg,120,90,https://i.ytimg.com/vi/O8rZfY4wg-8/mqdefault.jpg,320,180,https://i.ytimg.com/vi/O8rZfY4wg-8/hqdefault.jpg,480,360,tenaadam,none
Qe5UHJx_IKs,2018-07-08T06:44:45.000Z,UCADXAQ-WsE6YusaG2FC23BQ,BREAKING NEWS: Abiy Ahmed Arrives in Eritrea | ዶ/ር አብይ አስመራ ገቡ,"Check Out Ethiopian News, New Ethiopian Musics, Ethiopian Comedy and More Ethiopian Videos by Subscribing Here: https://goo.gl/kATImk Unauthorized use, ...",https://i.ytimg.com/vi/Qe5UHJx_IKs/default.jpg,120,90,https://i.ytimg.com/vi/Qe5UHJx_IKs/mqdefault.jpg,320,180,https://i.ytimg.com/vi/Qe5UHJx_IKs/hqdefault.jpg,480,360,tenaadam,none
