video_id,publishedAt,channelId,title,description,thumbnails.default.url,thumbnails.default.width,thumbnails.default.height,thumbnails.medium.url,thumbnails.medium.width,thumbnails.medium.height,thumbnails.high.url,thumbnails.high.width,thumbnails.high.height,channelTitle,liveBroadcastContent
eKjds4BxHs4,2018-02-25T11:15:20.000Z,UCQbrkts7SG5HwyVel1xL0Yw,Ethiopia: Documentary on Dr Abiy Ahmed,A documentary on Dr. Abiy Ahmed.,https://i.ytimg.com/vi/eKjds4BxHs4/default.jpg,120,90,https://i.ytimg.com/vi/eKjds4BxHs4/mqdefault.jpg,320,180,https://i.ytimg.com/vi/eKjds4BxHs4/hqdefault.jpg,480,360,EthioDaily,none
KwMtqgJ-MY0,2018-07-09T20:31:58.000Z,UC6bam4pQbuUgXnmyEFlSpNA,Arba Minch Residents Came Out to express support for Dr Abiy,Arba Minch Residents Came Out to express support for Dr Abiy.,https://i.ytimg.com/vi/KwMtqgJ-MY0/default.jpg,120,90,https://i.ytimg.com/vi/KwMtqgJ-MY0/mqdefault.jpg,320,180,https://i.ytimg.com/vi/KwMtqgJ-MY0/hqdefault.jpg,480,360,"Abbay Media - Ethiopia News, Views & Videos",none
-zaTarzeXkg,2018-07-05T00:30:29.000Z,UCQlvmUtvPPDET8tnkRPIocw,Obang Metho On  Dr Abiy Ahmed |Latest ethiopian news new today youtube video 2018,Best Latest ethiopian news new today youtube video 2018 Abiy Ahmed Ali is an Ethiopian politician. He is the 12th Prime Minister of Ethiopia. He is Chairman of ...,https://i.ytimg.com/vi/-zaTarzeXkg/default.jpg,120,90,https://i.ytimg.com/vi/-zaTarzeXkg/mqdefault.jpg,320,180,https://i.ytimg.com/vi/-zaTarzeXkg/hqdefault.jpg,480,360,ethiopia hagere,none
J2V7INmDCRw,2018-06-13T17:50:16.000Z,UCADXAQ-WsE6YusaG2FC23BQ,Mesay Mekonnen on the current Ethiopian affairs | TPLF | Dr Abiy Ahmed,"Check Out Ethiopian News, New Ethiopian Musics, Ethiopian Comedy and More Ethiopian Videos by Subscribing Here: https://goo.gl/kATImk Unauthorized use, ...",https://i.ytimg.com/vi/J2V7INmDCRw/default.jpg,120,90,https://i.ytimg.com/vi/J2V7INmDCRw/mqdefault.jpg,320,180,https://i.ytimg.com/vi/J2V7INmDCRw/hqdefault.jpg,480,360,tenaadam,none
RS7JdBy_GlQ,2018-07-08T20:56:56.000Z,UCADXAQ-WsE6YusaG2FC23BQ,Maritu Legesse -  Dr Abiy ዓብዬን አደራ | New Ethiopian Music 2018,"Check Out Ethiopian News, New Ethiopian Musics, Ethiopian Comedy and More Ethiopian Videos by Subscribing Here: https://goo.gl/kATImk New Amharic ...",https://i.ytimg.com/vi/RS7JdBy_GlQ/default.jpg,120,90,https://i.ytimg.com/vi/RS7JdBy_GlQ/mqdefault.jpg,320,180,https://i.ytimg.com/vi/RS7JdBy_GlQ/hqdefault.jpg,480,360,tenaadam,none
CivjINWbCac,2018-07-08T08:53:43.000Z,UCIXmPuo0pWdxTwPaOsvUBxw,Ethiopian Prime Minister Dr. Abiy Ahmed Visit to Eritrea,WALTA TV NEWS 7/7/2018.,https://i.ytimg.com/vi/CivjINWbCac/default.jpg,120,90,https://i.ytimg.com/vi/CivjINWbCac/mqdefault.jpg,320,180,https://i.ytimg.com/vi/CivjINWbCac/hqdefault.jpg,480,360,Walta Media and Communication Corporate S.c,none
PHt7ejDG3tU,2018-06-20T12:23:44.000Z,UC5OHRPjRa4XYIU5OQUdnDpg,ጠ/ሚንስትር አብይ አህመድ በሀዋሳ ከተማ ሲያለቅሱ Dr. Abiy Ahmed,"ጠ/ሚንስትር አብይ አህመድ በሀዋሳ ከተማ ሲያለቅሱ Dr. Abiy Ahmed https://youtu.be/PHt7ejDG3tU Kana tv, Kana drama, EBS TV, Jtv ethiopia,...",https://i.ytimg.com/vi/PHt7ejDG3tU/default.jpg,120,90,https://i.ytimg.com/vi/PHt7ejDG3tU/mqdefault.jpg,320,180,https://i.ytimg.com/vi/PHt7ejDG3tU/hqdefault.jpg,480,360,fikir tube,none
vidhHnvI2mU,2018-04-21T05:46:28.000Z,UCzgxEL622oq1hiVJZk5RbuQ,BOOQASHADII l RAYSALWASAARAHA l DALKA ETHIOPIA DR ABIY AHMED EE DEEGAANKA SOOMAALIDA ETHIOPIA l OO D,RAYSAL WASAARAHA CUSUB DR ABIY AHMED ALI BOOQASHO KU YIMID DDSI DEEGAANKA SOOMAALIDA ETHIOPIA JIGJIGA BOOQASHADIISII ...,https://i.ytimg.com/vi/vidhHnvI2mU/default.jpg,120,90,https://i.ytimg.com/vi/vidhHnvI2mU/mqdefault.jpg,320,180,https://i.ytimg.com/vi/vidhHnvI2mU/hqdefault.jpg,480,360,Jigjiga Tube,none
sZtxdQD79M8,2018-06-23T20:35:59.000Z,UCQlvmUtvPPDET8tnkRPIocw,ETV Breaking News Dr Abiy| ethiopian news new today youtube video 2018,Best Latest ethiopian news new today youtube video 2018 Abiy Ahmed Ali is an Ethiopian politician. He is the 12th Prime Minister of Ethiopia. He is Chairman of ...,https://i.ytimg.com/vi/sZtxdQD79M8/default.jpg,120,90,https://i.ytimg.com/vi/sZtxdQD79M8/mqdefault.jpg,320,180,https://i.ytimg.com/vi/sZtxdQD79M8/hqdefault.jpg,480,360,ethiopia hagere,none
KNEblp_lU00,2018-05-05T13:38:43.000Z,UC-aEwbUiSRTGc7ToOQrnSpg,Dr. Abiy Ahmed in Baalee Roobee,Dr. Abiy Ahmed in Baalee Roobee.,https://i.ytimg.com/vi/KNEblp_lU00/default.jpg,120,90,https://i.ytimg.com/vi/KNEblp_lU00/mqdefault.jpg,320,180,https://i.ytimg.com/vi/KNEblp_lU00/hqdefault.jpg,480,360,OROMO News,none
0ECz1BHbwks,2018-05-19T17:51:02.000Z,UCjY0Kj1RHou9rPIgDfn6mpw,ጠ/ሚ አብይ ስለ ሼህ አላሙድን ያደረጉት ንግግር Ethiopia Dr Abiy Ahmed,Ethiopia Dr Abiy Ahmed.,https://i.ytimg.com/vi/0ECz1BHbwks/default.jpg,120,90,https://i.ytimg.com/vi/0ECz1BHbwks/mqdefault.jpg,320,180,https://i.ytimg.com/vi/0ECz1BHbwks/hqdefault.jpg,480,360,Ethio Daily,none
lvD2poO-w-s,2018-06-10T11:00:22.000Z,UC5OHRPjRa4XYIU5OQUdnDpg,ጠ/ሚንስትር አብይ አህመድ ስለ ትግሬ ጄነራሎች ያልተጠበቀ ንግግር Dr. Abiy Ahmed,ጠ/ሚንስትር አብይ አህመድ ስለ ትግሬ ጄነራሎች ያልተጠበቀ ንግግር Dr. Abiy Ahmed https://youtu.be/lvD2poO-w-s ...,https://i.ytimg.com/vi/lvD2poO-w-s/default.jpg,120,90,https://i.ytimg.com/vi/lvD2poO-w-s/mqdefault.jpg,320,180,https://i.ytimg.com/vi/lvD2poO-w-s/hqdefault.jpg,480,360,fikir tube,none
EtKsNqhi_uU,2017-12-04T08:00:01.000Z,UCKPRl8W62exkgG1mfz_1ayw,Ethiopia Dr abiy ahmed በመጀመሪያ ካፖርትህን አዉልቅ,Ethiopia Dr abiy ahmed በመጀመሪያ ካፖርትህን አዉልቅ.,https://i.ytimg.com/vi/EtKsNqhi_uU/default.jpg,120,90,https://i.ytimg.com/vi/EtKsNqhi_uU/mqdefault.jpg,320,180,https://i.ytimg.com/vi/EtKsNqhi_uU/hqdefault.jpg,480,360,Agenda አጀንዳ,none
N0H0bQy4xOM,2018-06-21T12:19:34.000Z,UCUNXNhF1vboi9Tk-Svkqv5Q,Teddy afro new Ethiopian music- Dedicated to Dr. Abiy ahmed!!,"teddy afro, Mahder assefa, meseret mebrate, meron getnet, Selam tesfaye, hanan tarq, aziza ahmed, sayat demissie, zeritu kebede,ruta mengistab, etsehiwet ...",https://i.ytimg.com/vi/N0H0bQy4xOM/default.jpg,120,90,https://i.ytimg.com/vi/N0H0bQy4xOM/mqdefault.jpg,320,180,https://i.ytimg.com/vi/N0H0bQy4xOM/hqdefault.jpg,480,360,Hulu Neger,none
HDGlCaw9Dss,2018-06-17T23:14:10.000Z,UCADXAQ-WsE6YusaG2FC23BQ,Dw Eneweyaye (እንወያይ) -  TPLF & Dr Abiy Ahmed | Andargachew Tsige | Ahmedin Jebel | Eskinder Nega,"Check Out Ethiopian News, New Ethiopian Musics, Ethiopian Comedy and More Ethiopian Videos by Subscribing Here: https://goo.gl/kATImk Unauthorized use, ...",https://i.ytimg.com/vi/HDGlCaw9Dss/default.jpg,120,90,https://i.ytimg.com/vi/HDGlCaw9Dss/mqdefault.jpg,320,180,https://i.ytimg.com/vi/HDGlCaw9Dss/hqdefault.jpg,480,360,tenaadam,none
5RusA-qGOuA,2018-07-05T16:55:38.000Z,UCgdecrMD1EfiqFL_jlnPxvg,Fisum T -  Bandira | ባንዲራ - New Ethiopian Music Dedicated to Dr Abiy Ahmed,Ethiopian Music : Fisum T | ፍፁም ቲ - Bandira | ባንዲራ - New Ethiopian Music Dedicated to Dr Abiy Ahmed (Official Video) Google+ ...,https://i.ytimg.com/vi/5RusA-qGOuA/default.jpg,120,90,https://i.ytimg.com/vi/5RusA-qGOuA/mqdefault.jpg,320,180,https://i.ytimg.com/vi/5RusA-qGOuA/hqdefault.jpg,480,360,Hope Music Ethiopia,none
4VVGykgmgF4,2018-06-27T13:50:55.000Z,UCxMUNLpBqLTzPzdFKtfbDVw,ደ/ር አብይ አህመድ የሶስት መዕዘን ድርሰት ላይ መሳተፋቸዉን ገለፁ Dr. Abiy Ahmed script writing of Sost Maezen film,Ethiopian prime minister Dr. Abiy Ahmed has announced he has participated in the script writing of Sost Maezen movie during the welcoming speech of Eritrean ...,https://i.ytimg.com/vi/4VVGykgmgF4/default.jpg,120,90,https://i.ytimg.com/vi/4VVGykgmgF4/mqdefault.jpg,320,180,https://i.ytimg.com/vi/4VVGykgmgF4/hqdefault.jpg,480,360,Fikre Selam,none
ZJ_QKMSJcJA,2018-04-11T18:05:47.000Z,UCQlvmUtvPPDET8tnkRPIocw,Ethiopia:prime minister dr abiy ahmed &hr128|Ethiopian News Today,"Watch more about Ethiopian Entertainment videos such as Ethiopian movie, Ethiopian drama, Ethiopian music, Ethiopian comedy, Ethiopian health, senselet, ...",https://i.ytimg.com/vi/ZJ_QKMSJcJA/default.jpg,120,90,https://i.ytimg.com/vi/ZJ_QKMSJcJA/mqdefault.jpg,320,180,https://i.ytimg.com/vi/ZJ_QKMSJcJA/hqdefault.jpg,480,360,ethiopia hagere,none
1gbkFBH_FpU,2018-05-15T16:17:25.000Z,UCxMUNLpBqLTzPzdFKtfbDVw,ጠቅላይ ሚኒስትር ዶክተር አብይ ዛሬ ለመንግስት ባለስልጣናት ማሳሰቢያ  ሰጡ Dr. Abiy Ahmed,ጠቅላይ ሚኒስትር ዶክተር አብይ ዛሬ ለመንግስት ባለስልጣናት ማሳሰቢያና ገለጻ ሰጡ prime minister Dr. Abiy Ahmed. ጠቅላይ ሚኒስትር...,https://i.ytimg.com/vi/1gbkFBH_FpU/default.jpg,120,90,https://i.ytimg.com/vi/1gbkFBH_FpU/mqdefault.jpg,320,180,https://i.ytimg.com/vi/1gbkFBH_FpU/hqdefault.jpg,480,360,Fikre Selam,none
vow7PgzYs2A,2018-04-21T09:30:51.000Z,UCn-x-TvMDW28zgDM6SNXAiA,የወጣቱ ንግግር - አማራ በነፍጡ ነው ኢትዮጵያን ያኖረው! PM Abiy Ahmed in Bahir Dar.,አማራ በነፍጡ ነው ኢትዮጵያን ያኖረው! ጠ/ሚ አብይ አህመድ በባህርዳር PM Abiy Ahmed in Bahir Dar.,https://i.ytimg.com/vi/vow7PgzYs2A/default.jpg,120,90,https://i.ytimg.com/vi/vow7PgzYs2A/mqdefault.jpg,320,180,https://i.ytimg.com/vi/vow7PgzYs2A/hqdefault.jpg,480,360,EthioInfo,none
J0NQMfQGpNM,2018-07-08T09:33:40.000Z,UCplIxXPLmWcaLhBmwD2kV7Q,Prime Minister Abiy Ahmed in Asmara – reclaiming Ethiopia and Eritrea brotherhood,Ethiopia | ኢትዮጵያ ◌ Prime Minister Abiy Ahmed in Asmara – reclaiming Ethiopia and Eritrea brotherhood ...,https://i.ytimg.com/vi/J0NQMfQGpNM/default.jpg,120,90,https://i.ytimg.com/vi/J0NQMfQGpNM/mqdefault.jpg,320,180,https://i.ytimg.com/vi/J0NQMfQGpNM/hqdefault.jpg,480,360,About Ethiopia,none
MY_eP7kj5DI,2018-01-10T23:12:27.000Z,UCP48iQWLVVICH-GtyCR_DOQ,"Dr Abiy Ahmed ሙሰኞችን አጋለጡ 8 Feb, 2018",,https://i.ytimg.com/vi/MY_eP7kj5DI/default.jpg,120,90,https://i.ytimg.com/vi/MY_eP7kj5DI/mqdefault.jpg,320,180,https://i.ytimg.com/vi/MY_eP7kj5DI/hqdefault.jpg,480,360,Ethio Lucky All TV,none
kHhguMy850E,2018-06-24T20:41:00.000Z,UCADXAQ-WsE6YusaG2FC23BQ,WATCH: Temesgen Desalegn on Dr Abiy Ahmed,"Check Out Ethiopian News, New Ethiopian Musics, Ethiopian Comedy and More Ethiopian Videos by Subscribing Here: https://goo.gl/kATImk Unauthorized use, ...",https://i.ytimg.com/vi/kHhguMy850E/default.jpg,120,90,https://i.ytimg.com/vi/kHhguMy850E/mqdefault.jpg,320,180,https://i.ytimg.com/vi/kHhguMy850E/hqdefault.jpg,480,360,tenaadam,none
1vs8EigYAOU,2018-07-01T06:55:45.000Z,UCADXAQ-WsE6YusaG2FC23BQ,"Must Watch - Dr Abiy Ahmed Day in Bahir Dar, Ethiopia - Live","Check Out Ethiopian News, New Ethiopian Musics, Ethiopian Comedy and More Ethiopian Videos by Subscribing Here: https://goo.gl/kATImk Unauthorized use, ...",https://i.ytimg.com/vi/1vs8EigYAOU/default.jpg,120,90,https://i.ytimg.com/vi/1vs8EigYAOU/mqdefault.jpg,320,180,https://i.ytimg.com/vi/1vs8EigYAOU/hqdefault.jpg,480,360,tenaadam,none
8Zyk3AiJpDQ,2018-05-22T04:51:08.000Z,UC6bam4pQbuUgXnmyEFlSpNA,Letter to H.E Prime Minister Dr. Abiy Ahmed - From Meron Alemayehu,Letter to H.E Prime Minister Dr. Abiy Ahmed - From Meron Alemayehu.,https://i.ytimg.com/vi/8Zyk3AiJpDQ/default.jpg,120,90,https://i.ytimg.com/vi/8Zyk3AiJpDQ/mqdefault.jpg,320,180,https://i.ytimg.com/vi/8Zyk3AiJpDQ/hqdefault.jpg,480,360,"Abbay Media - Ethiopia News, Views & Videos",none
1XOOqxV-Nyw,2018-05-24T15:20:11.000Z,UC5OHRPjRa4XYIU5OQUdnDpg,ፕሮፌሰር ብርሀኑ ነጋ ስለ አብይ አህመድ የተናገረው Ethiopia Dr. Abiy Ahmed,"ፕሮፌሰር ብርሀኑ ነጋ ስለ አብይ አህመድ የተናገረው Ethiopia Dr. Abiy Ahmed https://youtu.be/1XOOqxV-Nyw Kana tv, Kana drama, EBS TV, Jtv...",https://i.ytimg.com/vi/1XOOqxV-Nyw/default.jpg,120,90,https://i.ytimg.com/vi/1XOOqxV-Nyw/mqdefault.jpg,320,180,https://i.ytimg.com/vi/1XOOqxV-Nyw/hqdefault.jpg,480,360,fikir tube,none
vEt39Djxh4g,2018-06-28T11:22:03.000Z,UCs8lV8NMuib7unJhFJOOkqA,Dr.Abiy ahmed: ከጠ/ሚ አብይ ፅህፈት-ቤት የወጣ አዲስ መግለጫ,Dr.Abiy ahmed: ከጠ/ሚ አብይ ፅህፈት-ቤት የወጣ አዲስ መግለጫ.,https://i.ytimg.com/vi/vEt39Djxh4g/default.jpg,120,90,https://i.ytimg.com/vi/vEt39Djxh4g/mqdefault.jpg,320,180,https://i.ytimg.com/vi/vEt39Djxh4g/hqdefault.jpg,480,360,Addis Neger,none
-lVMV7KV5Xc,2018-05-19T20:09:34.000Z,UCPrlLz0nHztMMLfwfkpGiWA,Dr Abiy Ahmed on Sheik Mohammed Hussein Al Amoudi,"Check Out Ethiopian News, New Ethiopian Musics, Ethiopian Comedy and More Ethiopian Videos by Subscribing Here: https://goo.gl/f1E8kB Senselet Drama ...",https://i.ytimg.com/vi/-lVMV7KV5Xc/default.jpg,120,90,https://i.ytimg.com/vi/-lVMV7KV5Xc/mqdefault.jpg,320,180,https://i.ytimg.com/vi/-lVMV7KV5Xc/hqdefault.jpg,480,360,Addis Tribune,none
jeK10y6LTWw,2018-04-14T02:31:19.000Z,UCADXAQ-WsE6YusaG2FC23BQ,Dr Abiy Ahmed on Tigray People,"Check Out Ethiopian News, New Ethiopian Musics, Ethiopian Comedy and More Ethiopian Videos by Subscribing Here: https://goo.gl/kATImk Unauthorized use, ...",https://i.ytimg.com/vi/jeK10y6LTWw/default.jpg,120,90,https://i.ytimg.com/vi/jeK10y6LTWw/mqdefault.jpg,320,180,https://i.ytimg.com/vi/jeK10y6LTWw/hqdefault.jpg,480,360,tenaadam,none
STGmqsBCHM0,2018-04-26T11:55:20.000Z,UCADXAQ-WsE6YusaG2FC23BQ,Ethiopia: PM Dr Abiy Ahmed's Speech In Awasa (Hawassa),"Check Out Ethiopian News, New Ethiopian Musics, Ethiopian Comedy and More Ethiopian Videos by Subscribing Here: https://goo.gl/kATImk Unauthorized use, ...",https://i.ytimg.com/vi/STGmqsBCHM0/default.jpg,120,90,https://i.ytimg.com/vi/STGmqsBCHM0/mqdefault.jpg,320,180,https://i.ytimg.com/vi/STGmqsBCHM0/hqdefault.jpg,480,360,tenaadam,none
Uwnnc3hSGfg,2018-07-08T18:55:19.000Z,UC_EcJddVDWRQeWlHVd9gfWw,PM Abiy Ahmed Speech in Asmara,PM Abiy Ahmed's speech during state dinner at the National Palace.,https://i.ytimg.com/vi/Uwnnc3hSGfg/default.jpg,120,90,https://i.ytimg.com/vi/Uwnnc3hSGfg/mqdefault.jpg,320,180,https://i.ytimg.com/vi/Uwnnc3hSGfg/hqdefault.jpg,480,360,borkena -   Ethiopian News,none
caUjI-QKQAg,2018-04-20T19:23:59.000Z,UCPrlLz0nHztMMLfwfkpGiWA,FULL: Dr Abiy Ahmed Speech in Gonder,"Check Out Ethiopian News, New Ethiopian Musics, Ethiopian Comedy and More Ethiopian Videos by Subscribing Here: https://goo.gl/f1E8kB Zemen Drama ...",https://i.ytimg.com/vi/caUjI-QKQAg/default.jpg,120,90,https://i.ytimg.com/vi/caUjI-QKQAg/mqdefault.jpg,320,180,https://i.ytimg.com/vi/caUjI-QKQAg/hqdefault.jpg,480,360,Addis Tribune,none
yCJFqzmHMqw,2018-06-25T19:35:27.000Z,UC9Mt0PqBDH707e9moDpY_qQ,Ethiopia ዶ/ር አብይ በዛሬው ዕለት ያሳለፏቸው ሰበር ውሳኔዎች Dr Abiy Ahmed,,https://i.ytimg.com/vi/yCJFqzmHMqw/default.jpg,120,90,https://i.ytimg.com/vi/yCJFqzmHMqw/mqdefault.jpg,320,180,https://i.ytimg.com/vi/yCJFqzmHMqw/hqdefault.jpg,480,360,Addis Konjo,none
I0TqiBynUlc,2018-06-25T13:31:54.000Z,UC5OHRPjRa4XYIU5OQUdnDpg,ቦንቡን ያፈነዳችው እብድ ማን እንደላካት ተናገረች Dr. Abiy Ahmed,"ቦንቡን ያፈነዳችው ማን እንደላካት ተናገረች Dr. Abiy Ahmed https://youtu.be/I0TqiBynUlc Kana tv, Kana drama, EBS TV, Jtv ethiopia, New Ethiopian...",https://i.ytimg.com/vi/I0TqiBynUlc/default.jpg,120,90,https://i.ytimg.com/vi/I0TqiBynUlc/mqdefault.jpg,320,180,https://i.ytimg.com/vi/I0TqiBynUlc/hqdefault.jpg,480,360,fikir tube,none
TMgOQsEExj8,2018-07-02T08:33:03.000Z,UChNiSzVzWsKBPElV_K0fsyQ,ABIY AHMED AND SADOR |ሳዶር እና ዶ/ር አብይ አስገራሚ ቪዲዮ| ADDISTIMES |ETHIOPIA,AMAZAING VIDEO OF DR ABI FAN CUTE KID SADOR SUBSCRIBE | LIKE | COMMENT.,https://i.ytimg.com/vi/TMgOQsEExj8/default.jpg,120,90,https://i.ytimg.com/vi/TMgOQsEExj8/mqdefault.jpg,320,180,https://i.ytimg.com/vi/TMgOQsEExj8/hqdefault.jpg,480,360,AddisTimes,none
T3mq3nBvHNg,2018-06-08T18:59:30.000Z,UCwga1dPCqBddbtq5KYRii2g,Ethiopia's Prime Minister Ahmed Abiy in Uganda on a State visit,Ethiopia's Prime Minister Abiy Ahmed Ali is in Uganda for a state visit at the invitation of President Yoweri Museveni. Ali will be the chief guest at the Heroes Day ...,https://i.ytimg.com/vi/T3mq3nBvHNg/default.jpg,120,90,https://i.ytimg.com/vi/T3mq3nBvHNg/mqdefault.jpg,320,180,https://i.ytimg.com/vi/T3mq3nBvHNg/hqdefault.jpg,480,360,NTVUganda,none
83h5zAgvfuI,2018-06-09T09:19:35.000Z,UCLqOfbLG-ov6S5Aa-Zp1Z4g,ተባለ እንዴ!? Prime Minister Abiy Ahmed visit to Washington DC | Donald Trump | Ethiopia,ተባለ እንዴ!? የዶ/ር አብይ የአሜሪካ ጉብኝት እና የዲሲው አታካራ | Prime Minister Abiy Ahmed visit to Washington DC | Donald Trump | Ethiopia | Ethiopia...,https://i.ytimg.com/vi/83h5zAgvfuI/default.jpg,120,90,https://i.ytimg.com/vi/83h5zAgvfuI/mqdefault.jpg,320,180,https://i.ytimg.com/vi/83h5zAgvfuI/hqdefault.jpg,480,360,All Things ኢትዮጵያ Ethiopia,none
pdU3_Yg7T_A,2018-04-04T18:22:59.000Z,UCADXAQ-WsE6YusaG2FC23BQ,WATCH - Lemma Megersa on Dr. Abiy Ahmed,"Check Out Ethiopian News, New Ethiopian Musics, Ethiopian Comedy and More Ethiopian Videos by Subscribing Here: https://goo.gl/kATImk Unauthorized use, ...",https://i.ytimg.com/vi/pdU3_Yg7T_A/default.jpg,120,90,https://i.ytimg.com/vi/pdU3_Yg7T_A/mqdefault.jpg,320,180,https://i.ytimg.com/vi/pdU3_Yg7T_A/hqdefault.jpg,480,360,tenaadam,none
FYo8DwVo8H4,2018-04-13T11:05:41.000Z,UCQlvmUtvPPDET8tnkRPIocw,Ethiopia :Prime Minister Dr Abiy Ahmed gets warm welcome Mekelle | Ethiopian News Today,"Watch more about Ethiopian Entertainment videos such as Ethiopian movie, Ethiopian drama, Ethiopian music, Ethiopian comedy, Ethiopian health, senselet, ...",https://i.ytimg.com/vi/FYo8DwVo8H4/default.jpg,120,90,https://i.ytimg.com/vi/FYo8DwVo8H4/mqdefault.jpg,320,180,https://i.ytimg.com/vi/FYo8DwVo8H4/hqdefault.jpg,480,360,ethiopia hagere,none
pIavAOqgoRg,2018-06-24T11:02:08.000Z,UC5OHRPjRa4XYIU5OQUdnDpg,ቦንብ ያፈነዳችውን እብድ የፈተሸቻት ጋዜጠኛ ለሰይፉ ያወጣችው ሚስጥር Dr. Abiy Ahmed,ቦንብ ያፈነዳችውን እብድ የፈተሸቻት ጋዜጠኛ ለሰይፉ ያወጣችው ሚስጥር Dr. Abiy Ahmed https://youtu.be/pIavAOqgoRg ...,https://i.ytimg.com/vi/pIavAOqgoRg/default.jpg,120,90,https://i.ytimg.com/vi/pIavAOqgoRg/mqdefault.jpg,320,180,https://i.ytimg.com/vi/pIavAOqgoRg/hqdefault.jpg,480,360,fikir tube,none
pBhNkFD-PpY,2018-06-26T19:54:57.000Z,UCxMUNLpBqLTzPzdFKtfbDVw,ዶ/ር  አብይ አህመድን ለመጠበቅ  ጠባቂያቸዉ ዛሬ  ይዞት የወጣዉ መሳሪያ Dr. Abiy Ahmed at Bole Airbort,Ethiopian prime minister Dr. Abiy Ahmed welcomed Eritrean Delegation at Bole Airport. ዶ/ር አብይ አህመድን ለመጠበቅ ጠባቂያቸዉ ዛሬ ይዞት የወጣዉ...,https://i.ytimg.com/vi/pBhNkFD-PpY/default.jpg,120,90,https://i.ytimg.com/vi/pBhNkFD-PpY/mqdefault.jpg,320,180,https://i.ytimg.com/vi/pBhNkFD-PpY/hqdefault.jpg,480,360,Fikre Selam,none
oG_-gsm_BFE,2018-06-23T11:43:00.000Z,UCn-x-TvMDW28zgDM6SNXAiA,ሰልፉ ላይ ቦንብ የጣለችው ሴት መሆኗ ተረጋገጠ PM Abiy Ahmed Rally Update,ሰልፉ ላይ ቦንብ የጣለችው ሴት መሆኗ ተረጋገጠ PM Abiy Ahmed Rally Update.,https://i.ytimg.com/vi/oG_-gsm_BFE/default.jpg,120,90,https://i.ytimg.com/vi/oG_-gsm_BFE/mqdefault.jpg,320,180,https://i.ytimg.com/vi/oG_-gsm_BFE/hqdefault.jpg,480,360,EthioInfo,none
TZNj9MjxCjM,2018-04-16T20:54:53.000Z,UCADXAQ-WsE6YusaG2FC23BQ,VOA Special ወልቃይት - Welkait | Atalay Zafe | Dr Abiy Ahmed | Gonder | Tigray,"Check Out Ethiopian News, New Ethiopian Musics, Ethiopian Comedy and More Ethiopian Videos by Subscribing Here: https://goo.gl/kATImk Unauthorized use, ...",https://i.ytimg.com/vi/TZNj9MjxCjM/default.jpg,120,90,https://i.ytimg.com/vi/TZNj9MjxCjM/mqdefault.jpg,320,180,https://i.ytimg.com/vi/TZNj9MjxCjM/hqdefault.jpg,480,360,tenaadam,none
3HVBS-QcHVc,2018-06-25T16:54:01.000Z,UCQlvmUtvPPDET8tnkRPIocw,Dr Abiy Ahmed donate blood to victims receiving medical care,Best Latest ethiopian news new today youtube video 2018 Abiy Ahmed Ali is an Ethiopian politician. He is the 12th Prime Minister of Ethiopia. He is Chairman of ...,https://i.ytimg.com/vi/3HVBS-QcHVc/default.jpg,120,90,https://i.ytimg.com/vi/3HVBS-QcHVc/mqdefault.jpg,320,180,https://i.ytimg.com/vi/3HVBS-QcHVc/hqdefault.jpg,480,360,ethiopia hagere,none
JQWLmIHW-Og,2018-03-31T12:11:53.000Z,UCADXAQ-WsE6YusaG2FC23BQ,Shukshukta (ሹክሹክታ) -  Dr Abiy Ahmed - የነብይ ብርቱካን ትንቢትና  እና ዶ/ር አብይ   | Ethiopia |  Prophet Birtukan,"Check Out Ethiopian News, New Ethiopian Musics, Ethiopian Comedy and More Ethiopian Videos by Subscribing Here: https://goo.gl/kATImk Unauthorized use, ...",https://i.ytimg.com/vi/JQWLmIHW-Og/default.jpg,120,90,https://i.ytimg.com/vi/JQWLmIHW-Og/mqdefault.jpg,320,180,https://i.ytimg.com/vi/JQWLmIHW-Og/hqdefault.jpg,480,360,tenaadam,none
W6arqnQOQZY,2018-06-02T07:20:10.000Z,UCEeSzRl1u-jhwGv93TR5vRA,PM Abiy Ahmed speaking about reform to the military,Ethiopia's prime minister Abiy Ahmed talks about national reform to the military.,https://i.ytimg.com/vi/W6arqnQOQZY/default.jpg,120,90,https://i.ytimg.com/vi/W6arqnQOQZY/mqdefault.jpg,320,180,https://i.ytimg.com/vi/W6arqnQOQZY/hqdefault.jpg,480,360,Ecadf Ethiopia,none
SCXSugRgahU,2018-06-02T09:37:42.000Z,UCn-x-TvMDW28zgDM6SNXAiA,ጠ/ሚ አብይ - አሁን የምናገረው ብሌር እንዲሰማ አልፈልግም ፤ በሚስጥር ይያዝልኝ PM Abiy Ahmed meets Tony Blair,ጠ/ሚ አብይ - አሁን የምናገረው ብሌር እንዲሰማ አልፈልግም ፤ በሚስጥር ይያዝልኝ PM Abiy Ahmed meets former PM of England Tony Blair.,https://i.ytimg.com/vi/SCXSugRgahU/default.jpg,120,90,https://i.ytimg.com/vi/SCXSugRgahU/mqdefault.jpg,320,180,https://i.ytimg.com/vi/SCXSugRgahU/hqdefault.jpg,480,360,EthioInfo,none
ywjTYrCCudY,2018-05-18T17:07:53.000Z,UCADXAQ-WsE6YusaG2FC23BQ,Ethiopia: PM Dr Abiy Ahmed in Saudi Arabia,"Check Out Ethiopian News, New Ethiopian Musics, Ethiopian Comedy and More Ethiopian Videos by Subscribing Here: https://goo.gl/kATImk Unauthorized use, ...",https://i.ytimg.com/vi/ywjTYrCCudY/default.jpg,120,90,https://i.ytimg.com/vi/ywjTYrCCudY/mqdefault.jpg,320,180,https://i.ytimg.com/vi/ywjTYrCCudY/hqdefault.jpg,480,360,tenaadam,none
q4dNU-bpCGk,2018-06-10T11:52:24.000Z,UCQlvmUtvPPDET8tnkRPIocw,Prime Minister Abiy  Arrives in Egypt |Best Latest ethiopian news new today youtube video 2018,Best Latest ethiopian news new today youtube video 2018 Abiy Ahmed Ali is an Ethiopian politician. He is the 12th Prime Minister of Ethiopia. He is Chairman of ...,https://i.ytimg.com/vi/q4dNU-bpCGk/default.jpg,120,90,https://i.ytimg.com/vi/q4dNU-bpCGk/mqdefault.jpg,320,180,https://i.ytimg.com/vi/q4dNU-bpCGk/hqdefault.jpg,480,360,ethiopia hagere,none
8bGDjSheC8A,2018-05-17T08:59:31.000Z,UC5OHRPjRa4XYIU5OQUdnDpg,ጠ/ሚንስትር እንደምሆን ባለቤቴ ፓስተር ዝናሽ ተንብያልኝ ነበር Ethiopia Dr. Abiy Ahmed,ጠ/ሚንስትር እንደምሆን ባላቤቴ ፓስተር ዝናሽ ተንብያልኝ ነበር Ethiopia Dr. Abiy Ahmed https://youtu.be/8bGDjSheC8A ...,https://i.ytimg.com/vi/8bGDjSheC8A/default.jpg,120,90,https://i.ytimg.com/vi/8bGDjSheC8A/mqdefault.jpg,320,180,https://i.ytimg.com/vi/8bGDjSheC8A/hqdefault.jpg,480,360,fikir tube,none
Fi0AnTrgkU0,2018-05-27T23:31:11.000Z,UCADXAQ-WsE6YusaG2FC23BQ,"Andualem Arage Speech In Amsterdam, Netherlands | Birtukan Mideksa | Dr Abiy Ahmed | Lema Megersa","Check Out Ethiopian News, New Ethiopian Musics, Ethiopian Comedy and More Ethiopian Videos by Subscribing Here: https://goo.gl/kATImk Unauthorized use, ...",https://i.ytimg.com/vi/Fi0AnTrgkU0/default.jpg,120,90,https://i.ytimg.com/vi/Fi0AnTrgkU0/mqdefault.jpg,320,180,https://i.ytimg.com/vi/Fi0AnTrgkU0/hqdefault.jpg,480,360,tenaadam,none
D_nfPrIwKGc,2018-06-30T22:00:00.000Z,UCn-x-TvMDW28zgDM6SNXAiA,ጠ/ሚ አብይ ስለ ኬኔዲ መንገሻ የተናገሩት ይፋ ወጣ PM Abiy About Kennedy Mengesha,ጠ/ሚ አብይ ስለ ኬኔዲ መንገሻ የተናገሩት ይፋ ወጣ PM Abiy Ahmed About Kennedy Mengesha. Tadias Addis with Seifu Fantahun.,https://i.ytimg.com/vi/D_nfPrIwKGc/default.jpg,120,90,https://i.ytimg.com/vi/D_nfPrIwKGc/mqdefault.jpg,320,180,https://i.ytimg.com/vi/D_nfPrIwKGc/hqdefault.jpg,480,360,EthioInfo,none
X1_ZHnDs0RM,2018-04-02T13:48:09.000Z,UCQlvmUtvPPDET8tnkRPIocw,Ethiopia Prime Minster Dr Abiy Ahmed's First interview& Welcome|Ethiopian news today,"Watch more about Ethiopian Entertainment videos such as Ethiopian movie, Ethiopian drama, Ethiopian music, Ethiopian comedy, Ethiopian health, senselet, ...",https://i.ytimg.com/vi/X1_ZHnDs0RM/default.jpg,120,90,https://i.ytimg.com/vi/X1_ZHnDs0RM/mqdefault.jpg,320,180,https://i.ytimg.com/vi/X1_ZHnDs0RM/hqdefault.jpg,480,360,ethiopia hagere,none
GsXBfbroa9k,2018-06-23T08:06:24.000Z,UChrfQqipNvkqta6nBIvR3RA,Ethiopia# Details On the Bomb Explosion Dr. Abiy Rally,,https://i.ytimg.com/vi/GsXBfbroa9k/default.jpg,120,90,https://i.ytimg.com/vi/GsXBfbroa9k/mqdefault.jpg,320,180,https://i.ytimg.com/vi/GsXBfbroa9k/hqdefault.jpg,480,360,GW-Ethiopia,none
S3wMGiT74SI,2018-06-19T18:09:02.000Z,UC5OHRPjRa4XYIU5OQUdnDpg,ጠ/ሚንስትር አብይ ዛሬ በሀዋሳ ያደረጉት አስገራሚ ንግግር Dr. Abiy Ahmed,EBC በሃዋሣ ከጠፋው የሠው ህይወትና ንብረት ውድመት ጀርባ ያሉ አካላት ለህግ ለማቅረብ ይሰራል-- ጠ-ሚ ዐቢይ አህመድ_HD ...,https://i.ytimg.com/vi/S3wMGiT74SI/default.jpg,120,90,https://i.ytimg.com/vi/S3wMGiT74SI/mqdefault.jpg,320,180,https://i.ytimg.com/vi/S3wMGiT74SI/hqdefault.jpg,480,360,fikir tube,none
